LMIcaseid,URL,Casetitle,Civilaction,Venue,YearFiled,Filingdate,Declaratoryjudgment,NPECode,Patents,# Of Patents,PrimaryPatent,IPC Url ,IPC,PrimaryClass,First4level,Filingdate1,B4,B3,B2,B1,Q0,A1,A2,A3,A4,Casetitle1,Casetitle2,y,tag,dup,,,,,,,
2000058595,http://law.lexmachina.com/cases/7366,"ALTANA PHARMA AG et al v. SUN PHARMACEUTICAL INDUSTRIES, LTD. et al",2:05-cv-01966,D.N.J.,2005, 4/13/2005,0,8,4758579,1,4758579,http://patft.uspto.gov/netacgi/nph-Parser?patentnumber=4758579,C07D 235/26 (20060101); C07D 213/00 (20060101); C07D 235/00 (20060101); C07D 213/65 (20060101); C07D 213/89 (20060101); C07D 213/69 (20060101); C07D 317/52 (20060101); C07D 317/00 (20060101); C07D 319/20 (20060101); C07D 319/00 (20060101); C07D 401/00 (20060101); C07D 401/12 (20060101); C07D 491/00 (20060101); C07D 491/04 (20060101); C07D 403/12 (); A61K 031/44 (),C07D 235/26 ,C07D 235,4/13/2005,,,,,,,,,,ALTANA PHARMA AG et al,"SUN PHARMACEUTICAL INDUSTRIES, LTD. et al",1750,1,0,,,,,,,
25298,http://law.lexmachina.com/cases/2000057016,Cephalon Inc. v. Sun Pharma Global FZE et al,1:13-cv-02096,D.Del.,2013,12/26/2013,0,8,"8436190,8445524",2,8436190,http://patft.uspto.gov/netacgi/nph-Parser?patentnumber=8436190,C07D 235/04 (20060101),C07D 235/04 ,C07D 235,12/26/2013,,,,,,,,,,Cephalon Inc.,Sun Pharma Global FZE et al,2345,0,2,,,,,,,
2000033013,http://law.lexmachina.com/cases/2000004075,Bristol-Myers Squibb Company v. Teva Pharmaceuticals USA Inc. et al,1:10-cv-00805,D.Del.,2010, 9/22/2010,0,8,5206244,1,5206244,http://patft.uspto.gov/netacgi/nph-Parser?patentnumber=5206244,C07D 239/00 (20060101); C07D 239/54 (20060101); C07D 239/553 (20060101); C07D 239/46 (20060101); C07D 473/00 (20060101); A61K 031/52 (); A61K 031/505 (); C07D 473/16 (); C07D 473/18 (),C07D 239/00 ,C07D 239,9/22/2010,,,,,,,,,,Bristol-Myers Squibb Company,Teva Pharmaceuticals USA Inc. et al,2211,1,0,,,,,,,
2000024394,http://law.lexmachina.com/cases/2000084549,AstraZeneca LP et al vs. Apotex Inc. et al,1:15-cv-01058,D.Del.,2015,11/16/2015,0,8,"6525060,7250419,7265124,8425934",4,6525060,http://patft.uspto.gov/netacgi/nph-Parser?patentnumber=6525060,C07D 239/48 (20060101); C07D 239/00 (20060101); C07D 487/04 (20060101); C07D 487/00 (20060101); A61K 031/519 (); C07D 487/04 (),C07D 239/48 ,C07D 239,11/16/2015,,,,,,,,,,AstraZeneca LP et al vs. Apotex Inc. et al,,1938,1,0,,,,,,,
2000069256,http://law.lexmachina.com/cases/2000003215,AstraZeneca Pharmaceuticals LP et al v. Glenmark Generics Inc. USA,1:10-cv-00543,D.Del.,2010, 6/21/2010,0,8,RE37314,1,RE37314,http://patft.uspto.gov/netacgi/nph-Parser?patentnumber=RE37314,C07D 239/34 (20060101); C07D 239/42 (20060101); C07D 239/00 (20060101); C07D 239/38 (20060101); A61K 031/505 (); C07D 239/34 (); C07D 239/38 (); C07D 239/42 (),C07D 239/34 ,C07D 239,6/21/2010,,,,,,,,,,AstraZeneca Pharmaceuticals LP et al,Glenmark Generics Inc. USA,1941,0,7,,,,,,,
9759,http://law.lexmachina.com/cases/2000050852,"Eisai Co. Ltd. et al. v. Lupin Ltd., et al.",1:13-cv-01281,D.Del.,2013, 7/24/2013,0,8,"6740669,7750028,8076362",3,6740669,http://patft.uspto.gov/netacgi/nph-Parser?patentnumber=6740669,C07D 249/04 (20060101); C07D 249/00 (20060101); A61K 031/419 (); C07D 249/04 (),C07D 249/04 ,C07D 249,7/24/2013,,,,,,,,,,Eisai Co. Ltd. et al.,"Lupin Ltd., et al.",2792,1,0,,,,,,,
2000060136,http://law.lexmachina.com/cases/2000071199,Eisai Co. Ltd. et al v. Roxane Laboratories Inc.,1:14-cv-01511,D.Del.,2014,12/23/2014,0,8,"6740669,7750028",2,6740669,http://patft.uspto.gov/netacgi/nph-Parser?patentnumber=6740669,C07D 249/04 (20060101); C07D 249/00 (20060101); A61K 031/419 (); C07D 249/04 (),C07D 249/04 ,C07D 249,12/23/2014,,,,,,,,,,Eisai Co. Ltd. et al,Roxane Laboratories Inc.,2791,1,0,,,,,,,
21834,http://law.lexmachina.com/cases/2000002279,"Merck, Sharp & Dohme Corp. et al v. Teva Pharmaceuticals USA, Inc. et al",1:10-cv-01851,S.D.N.Y.,2010,  3/9/2010,0,8,"6639071,6939964",2,6639071,http://patft.uspto.gov/netacgi/nph-Parser?patentnumber=6639071,C07D 265/18 (20060101); C07D 265/00 (20060101); C07D 265/18 (),C07D 265/18 ,C07D 265,3/9/2010,,,,,,,,,,"Merck, Sharp & Dohme Corp. et al","Teva Pharmaceuticals USA, Inc. et al",4006,1,0,,,,,,,
24083,http://law.lexmachina.com/cases/2000052673,"MERCK, SHARP & DOHME CORP. et al v. AUROBINDO PHARMA LTD. et al",1:13-cv-05442,D.N.J.,2013, 9/11/2013,0,8,"6639071,6673372,6939964",3,6639071,http://patft.uspto.gov/netacgi/nph-Parser?patentnumber=6639071,C07D 265/18 (20060101); C07D 265/00 (20060101); C07D 265/18 (),C07D 265/18 ,C07D 265,9/11/2013,,,,,,,,,,"MERCK, SHARP & DOHME CORP. et al",AUROBINDO PHARMA LTD. et al,4005,1,0,,,,,,,
2000042980,http://law.lexmachina.com/cases/1720,Boehringer Ingelheim International GMBH et al v. Mylan Pharmaceuticals Inc.,1:05-cv-00854,D.Del.,2005,12/12/2005,0,8,4886812,1,4886812,http://patft.uspto.gov/netacgi/nph-Parser?patentnumber=4886812,C07D 277/00 (20060101); C07D 277/82 (20060101); C07D 277/82 (); A01K 031/425 (),C07D 277/00 ,C07D 277,12/12/2005,,,,,,,,,,Boehringer Ingelheim International GMBH et al,Mylan Pharmaceuticals Inc.,2163,1,0,,,,,,,
2000081625,http://law.lexmachina.com/cases/2000058094,Teijin Limited et al v. Ranbaxy Pharmaceuticals Inc. et al,1:14-cv-00117,D.Del.,2014, 1/31/2014,0,8,6225474,1,6225474,http://patft.uspto.gov/netacgi/nph-Parser?patentnumber=6225474,C07D 277/56 (20060101); C07D 277/00 (20060101); C07C 277/18 (),C07D 277/56 ,C07D 277,1/31/2014,,,,,,,,,,Teijin Limited et al,Ranbaxy Pharmaceuticals Inc. et al,5389,0,3,,,,,,,
24205,http://law.lexmachina.com/cases/2000058437,Teijin Limited et al v. Lupin Limited et al,1:14-cv-00184,D.Del.,2014, 2/12/2014,0,8,"6225474,7361676,8372872",3,6225474,http://patft.uspto.gov/netacgi/nph-Parser?patentnumber=6225474,C07D 277/56 (20060101); C07D 277/00 (20060101); C07C 277/18 (),C07D 277/56 ,C07D 277,2/12/2014,,,,,,,,,,Teijin Limited et al,Lupin Limited et al,5389,1,1,,,,,,,
2000063672,http://law.lexmachina.com/cases/2000054757,"Teijin Limited et al. v. Dr. Reddys Laboratories Ltd., et al.",1:13-cv-01780,D.Del.,2013,10/30/2013,0,8,"6225474,7361676,8372872",3,6225474,http://patft.uspto.gov/netacgi/nph-Parser?patentnumber=6225474,C07D 277/56 (20060101); C07D 277/00 (20060101); C07C 277/18 (),C07D 277/56 ,C07D 277,10/30/2013,,,,,,,,,,Teijin Limited et al.,"Dr. Reddys Laboratories Ltd., et al.",5390,1,0,,,,,,,
2000077839,http://law.lexmachina.com/cases/2000073150,ABBVIE INC. et al v. MYLAN PHARMACEUTICALS INC. et al,1:15-cv-01402,N.D.Ill.,2015, 2/13/2015,0,8,"7148359,7364752,8025899,8268349,8309613,8377952,8399015,8470347,8691878",9,7148359,http://patft.uspto.gov/netacgi/nph-Parser?patentnumber=7148359,C07D 277/30 (20060101),C07D 277/30 ,C07D 277,2/13/2015,,,,,,,,,,ABBVIE INC. et al,MYLAN PHARMACEUTICALS INC. et al,1590,1,0,,,,,,,
2000034884,http://law.lexmachina.com/cases/79026,"ASTRAZENECA PHARMACEUTICALS LP et al v. HANDA PHARMACEUTICALS, LLC et al",3:08-cv-05997,D.N.J.,2008, 12/8/2008,0,8,"4879288,5948437",2,4879288,http://patft.uspto.gov/netacgi/nph-Parser?patentnumber=4879288,C07D 281/16 (20060101); C07D 281/00 (20060101); C07D 417/04 (); A61K 031/555 (),C07D 281/16 ,C07D 281,12/8/2008,,,,,,,,,,ASTRAZENECA PHARMACEUTICALS LP et al,"HANDA PHARMACEUTICALS, LLC et al",1941,0,7,,,,,,,
2000029813,http://law.lexmachina.com/cases/5405,"ASTRAZENECA PHARMACEUTICALS LP et al v. TEVA PHARMACEUTICALS USA, INC. et al",2:06-cv-01528,D.N.J.,2006, 3/31/2006,0,8,4879288,1,4879288,http://patft.uspto.gov/netacgi/nph-Parser?patentnumber=4879288,C07D 281/16 (20060101); C07D 281/00 (20060101); C07D 417/04 (); A61K 031/555 (),C07D 281/16 ,C07D 281,3/31/2006,,,,,,,,,,ASTRAZENECA PHARMACEUTICALS LP et al,"TEVA PHARMACEUTICALS USA, INC. et al",1942,0,6,,,,,,,
2000001692,http://law.lexmachina.com/cases/2000024122,Astrazeneca Pharmaceuticals LP et al v. Intellipharmaceutics Corporation et al,1:11-cv-04498,S.D.N.Y.,2011, 6/30/2011,0,8,"4879288,5948437",2,4879288,http://patft.uspto.gov/netacgi/nph-Parser?patentnumber=4879288,C07D 281/16 (20060101); C07D 281/00 (20060101); C07D 417/04 (); A61K 031/555 (),C07D 281/16 ,C07D 281,6/30/2011,,,,,,,,,,Astrazeneca Pharmaceuticals LP et al,Intellipharmaceutics Corporation et al,1942,1,2,,,,,,,
2000007379,http://law.lexmachina.com/cases/2000071563,"SANOFI-AVENTIS U.S. LLC et al v. ACCORD HEALTHCARE, INC.",1:15-cv-00018,M.D.N.C.,2015,  1/7/2015,0,8,5847170,1,5847170,http://patft.uspto.gov/netacgi/nph-Parser?patentnumber=5847170,C07D 305/00 (20060101); C07D 305/14 (20060101); C07D 305/14 (),C07D 305/00 ,C07D 305,1/7/2015,,,,,,,,,,SANOFI-AVENTIS U.S. LLC et al,"ACCORD HEALTHCARE, INC.",4924,0,2,,,,,,,
2000068248,http://law.lexmachina.com/cases/2000071307,"SANOFI-AVENTIS U.S. LLC et al v. ACCORD HEALTHCARE, INC.",3:14-cv-08079,D.N.J.,2014,12/29/2014,0,8,5847170,1,5847170,http://patft.uspto.gov/netacgi/nph-Parser?patentnumber=5847170,C07D 305/00 (20060101); C07D 305/14 (20060101); C07D 305/14 (),C07D 305/00 ,C07D 305,12/29/2014,,,,,,,,,,SANOFI-AVENTIS U.S. LLC et al,"ACCORD HEALTHCARE, INC.",4924,1,7,,,,,,,
2000006731,http://law.lexmachina.com/cases/2000071309,"SANOFI-AVENTIS U.S. LLC et al v. BPI LABS, LLC et al",3:14-cv-08081,D.N.J.,2014,12/29/2014,0,8,5847170,1,5847170,http://patft.uspto.gov/netacgi/nph-Parser?patentnumber=5847170,C07D 305/00 (20060101); C07D 305/14 (20060101); C07D 305/14 (),C07D 305/00 ,C07D 305,12/29/2014,,,,,,,,,,SANOFI-AVENTIS U.S. LLC et al,"BPI LABS, LLC et al",4924,0,3,,,,,,,
2000076405,http://law.lexmachina.com/cases/2000002388,"ELI LILLY AND COMPANY v. HOSPIRA, INC.",1:10-cv-00346,S.D.Ind.,2010, 3/23/2010,0,8,"4808614,5464826",2,4808614,http://patft.uspto.gov/netacgi/nph-Parser?patentnumber=4808614,C07D 307/00 (20060101); C07D 307/33 (20060101); C07D 317/30 (20060101); C07H 5/02 (20060101); C07H 5/00 (20060101); C07D 317/00 (20060101); C07H 19/00 (20060101); C07H 19/04 (20060101); C07H 11/00 (20060101); A61K 031/505 (); A61K 031/52 (),C07D 307/00 ,C07D 307,3/23/2010,,,,,,,,,,ELI LILLY AND COMPANY,"HOSPIRA, INC.",2817,0,9,,,,,,,
2000002234,http://law.lexmachina.com/cases/84655,ELI LILLY AND COMPANY v. LUPIN LIMITED et al,1:08-cv-01596,S.D.Ind.,2008,11/24/2008,0,8,"5023269,5508276",2,5023269,http://patft.uspto.gov/netacgi/nph-Parser?patentnumber=5023269,C07D 307/52 (20060101); C07D 213/38 (20060101); C07D 307/00 (20060101); C07D 213/00 (20060101); C07D 333/28 (20060101); C07D 277/00 (20060101); C07D 333/00 (20060101); C07D 333/20 (20060101); C07D 277/28 (20060101); A61K 031/38 (); A61K 031/44 (); C07D 333/16 (),C07D 307/52 ,C07D 307,11/24/2008,,,,,,,,,,ELI LILLY AND COMPANY,LUPIN LIMITED et al,2817,0,7,,,,,,,
1000000603,http://law.lexmachina.com/cases/79188,"ELI LILLY AND COMPANY v. AUROBINDO PHARMA USA, INC. et al",3:08-cv-06137,D.N.J.,2008,12/12/2008,0,8,5023269,1,5023269,http://patft.uspto.gov/netacgi/nph-Parser?patentnumber=5023269,C07D 307/52 (20060101); C07D 213/38 (20060101); C07D 307/00 (20060101); C07D 213/00 (20060101); C07D 333/28 (20060101); C07D 277/00 (20060101); C07D 333/00 (20060101); C07D 333/20 (20060101); C07D 277/28 (20060101); A61K 031/38 (); A61K 031/44 (); C07D 333/16 (),C07D 307/52 ,C07D 307,12/12/2008,,,,,,,,,,ELI LILLY AND COMPANY,"AUROBINDO PHARMA USA, INC. et al",2817,0,8,,,,,,,
11489,http://law.lexmachina.com/cases/79189,"ELI LILLY AND COMPANY v. COBALT LABORATORIES, INC.",3:08-cv-06138,D.N.J.,2008,12/12/2008,0,8,5023269,1,5023269,http://patft.uspto.gov/netacgi/nph-Parser?patentnumber=5023269,C07D 307/52 (20060101); C07D 213/38 (20060101); C07D 307/00 (20060101); C07D 213/00 (20060101); C07D 333/28 (20060101); C07D 277/00 (20060101); C07D 333/00 (20060101); C07D 333/20 (20060101); C07D 277/28 (20060101); A61K 031/38 (); A61K 031/44 (); C07D 333/16 (),C07D 307/52 ,C07D 307,12/12/2008,,,,,,,,,,ELI LILLY AND COMPANY,"COBALT LABORATORIES, INC.",2817,0,1,,,,,,,
2000077651,http://law.lexmachina.com/cases/14948,"ELI LILLY AND COMPANY et al v. DR. REDDYS LABORATORIES, LTD.",1:03-cv-00337,S.D.Ind.,2003,  3/6/2003,0,8,5229382,1,5229382,http://patft.uspto.gov/netacgi/nph-Parser?patentnumber=5229382,C07D 333/00 (20060101); C07D 333/38 (20060101); C07D 495/00 (20060101); C07D 495/04 (20060101); A61K 031/55 (); C07D 495/04 (),C07D 333/00 ,C07D 333,3/6/2003,,,,,,,,,,ELI LILLY AND COMPANY et al,"DR. REDDYS LABORATORIES, LTD.",2816,1,2,,,,,,,
2000058122,http://law.lexmachina.com/cases/14829,"ELI LILLY AND COMPANY v. TEVA PHARMACEUTICALS USA, INC.",1:02-cv-01402,S.D.Ind.,2002,  9/9/2002,0,8,5229382,1,5229382,http://patft.uspto.gov/netacgi/nph-Parser?patentnumber=5229382,C07D 333/00 (20060101); C07D 333/38 (20060101); C07D 495/00 (20060101); C07D 495/04 (20060101); A61K 031/55 (); C07D 495/04 (),C07D 333/00 ,C07D 333,9/9/2002,,,,,,,,,,ELI LILLY AND COMPANY,"TEVA PHARMACEUTICALS USA, INC.",2818,0,10,,,,,,,
2000066144,http://law.lexmachina.com/cases/14903,"ELI LILLY AND COMPANY et al v. TEVA PHARMACEUTICALS USA, INC.",1:05-cv-00595,S.D.Ind.,2005, 4/22/2005,0,8,5229382,1,5229382,http://patft.uspto.gov/netacgi/nph-Parser?patentnumber=5229382,C07D 333/00 (20060101); C07D 333/38 (20060101); C07D 495/00 (20060101); C07D 495/04 (20060101); A61K 031/55 (); C07D 495/04 (),C07D 333/00 ,C07D 333,4/22/2005,,,,,,,,,,ELI LILLY AND COMPANY et al,"TEVA PHARMACEUTICALS USA, INC.",2816,0,6,,,,,,,
2000084999,http://law.lexmachina.com/cases/6695,SCHERING CORPORATION v. MYLAN PHARMACEUTICAL,2:00-cv-01657,D.N.J.,2000,  4/7/2000,0,8,"4282233,4659716,4863931",3,4282233,http://patft.uspto.gov/netacgi/nph-Parser?patentnumber=4282233,C07D 401/00 (20060101); C07D 401/00 (20060101); C07D 401/04 (20060101); C07D 401/04 (20060101); A61K 031/445 (); C07D 401/04 (),C07D 401/00 ,C07D 401,4/7/2000,,,,,,,,,,SCHERING CORPORATION,MYLAN PHARMACEUTICAL,4957,0,1,,,,,,,
2000044711,http://law.lexmachina.com/cases/17118,"Aktiebolaget Hassle, et al v. Andrx Pharmaceutical, et al",0:01-cv-06749,S.D.Fla.,2001,  5/4/2001,1,8,4508905,1,4508905,http://patft.uspto.gov/netacgi/nph-Parser?patentnumber=4508905,C07D 401/00 (20060101); C07D 401/12 (20060101); C07D 401/12 (),C07D 401/00 ,C07D 401,5/4/2001,,,,,,,,,,"Aktiebolaget Hassle, et al","Andrx Pharmaceutical, et al",1688,1,0,,,,,,,
2000056711,http://law.lexmachina.com/cases/2000036594,CELGENE CORPORATION v. NATCO PHARMA LIMITED et al,2:12-cv-04571,D.N.J.,2012, 7/20/2012,0,8,"5635517,6045501,6281230,6315720,6555554,6561976,6561977,6755784,6767326,6908432,7119106,7189740,7465800,7968569,7977357,8193219,8204763",17,5635517,http://patft.uspto.gov/netacgi/nph-Parser?patentnumber=5635517,C07D 401/04 (20060101); C07D 401/04 (20060101); C07D 401/00 (20060101); C07D 401/00 (20060101); A61K 031/445 (); C07D 401/04 (),C07D 401/04 ,C07D 401,7/20/2012,,,,,,,,,,CELGENE CORPORATION,NATCO PHARMA LIMITED et al,2330,1,1,,,,,,,
2000069260,http://law.lexmachina.com/cases/2000030219,ASTRAZENECA AB et al v. TORRENT PHARMACEUTICALS LIMITED et al,3:12-cv-00506,D.N.J.,2012, 1/26/2012,0,8,"5714504,5877192,6875872",3,5714504,http://patft.uspto.gov/netacgi/nph-Parser?patentnumber=5714504,C07D 401/12 (20060101); C07D 401/00 (20060101); C07D 401/12 (); A61K 031/44 (),C07D 401/12 ,C07D 401,1/26/2012,,,,,,,,,,ASTRAZENECA AB et al,TORRENT PHARMACEUTICALS LIMITED et al,1929,0,2,,,,,,,
2000000350,http://law.lexmachina.com/cases/2000031824,AstraZeneca AB et al v. Mylan Laboratories Limited et al,1:12-cv-00300,D.Del.,2012, 3/12/2012,0,8,"5714504,5877192,6875872",3,5714504,http://patft.uspto.gov/netacgi/nph-Parser?patentnumber=5714504,C07D 401/12 (20060101); C07D 401/00 (20060101); C07D 401/12 (); A61K 031/44 (),C07D 401/12 ,C07D 401,3/12/2012,,,,,,,,,,AstraZeneca AB et al,Mylan Laboratories Limited et al,1929,1,1,,,,,,,
25417,http://law.lexmachina.com/cases/7513,"ASTRAZENECA AB et al v. RANBAXY PHARMACEUTICALS, INC. et al",3:05-cv-05553,D.N.J.,2005,11/21/2005,0,8,"5714504,5877192,5948789,6369085,6428810,6875872,6147103",7,5714504,http://patft.uspto.gov/netacgi/nph-Parser?patentnumber=5714504,C07D 401/12 (20060101); C07D 401/00 (20060101); C07D 401/12 (); A61K 031/44 (),C07D 401/12 ,C07D 401,11/21/2005,,,,,,,,,,ASTRAZENECA AB et al,"RANBAXY PHARMACEUTICALS, INC. et al",1929,0,3,,,,,,,
2000073757,http://law.lexmachina.com/cases/2000080890,ASTRAZENECA AB et al v. LUPIN LTD. et al,3:15-cv-06092,D.N.J.,2015,  8/7/2015,0,"8, 13","6369085,6428810,7411070",3,6369085,http://patft.uspto.gov/netacgi/nph-Parser?patentnumber=6369085,C07D 401/12 (20060101); C07D 401/00 (20060101); A61K 031/443 (); C07D 401/12 (),C07D 401/12 ,C07D 401,8/7/2015,,,,,,,,,,ASTRAZENECA AB et al,LUPIN LTD. et al,6903,0,5,,,,,,,
12563,http://law.lexmachina.com/cases/2000027569,"ASTRAZENECA AB et al v. ANCHEN PHARMACEUTICALS, INC.",3:11-cv-06348,D.N.J.,2011,10/28/2011,0,8,"6369085,6926907,7411070,7745466",4,6369085,http://patft.uspto.gov/netacgi/nph-Parser?patentnumber=6369085,C07D 401/12 (20060101); C07D 401/00 (20060101); A61K 031/443 (); C07D 401/12 (),C07D 401/12 ,C07D 401,10/28/2011,,,,,,,,,,ASTRAZENECA AB et al,"ANCHEN PHARMACEUTICALS, INC.",1927,1,4,,,,,,,
2000071635,http://law.lexmachina.com/cases/2000084931,"ASTRAZENECA AB et al v. DR. REDDYS LABORATORIES, INC. et al",3:15-cv-08267,D.N.J.,2015,11/19/2015,0,"8, 13","6369085,7411070",2,6369085,http://patft.uspto.gov/netacgi/nph-Parser?patentnumber=6369085,C07D 401/12 (20060101); C07D 401/00 (20060101); A61K 031/443 (); C07D 401/12 (),C07D 401/12 ,C07D 401,11/19/2015,,,,,,,,,,ASTRAZENECA AB et al,"DR. REDDYS LABORATORIES, INC. et al",6903,0,1,,,,,,,
2000046618,http://law.lexmachina.com/cases/2000030299,"Takeda Pharmaceutical Co., Ltd. et al v. Sandoz, Inc.",3:12-cv-00446,N.D.Cal.,2012, 1/27/2012,0,8,"6462058,6664276,6939971,7285668,7790755",5,6462058,http://patft.uspto.gov/netacgi/nph-Parser?patentnumber=6462058,C07D 401/12 (20060101); C07D 401/00 (20060101); C07D 401/12 (); A61K 031/443 (),C07D 401/12 ,C07D 401,1/27/2012,,,,,,,,,,"Takeda Pharmaceutical Co., Ltd. et al","Sandoz, Inc.",5348,0,2,,,,,,,
2000001842,http://law.lexmachina.com/cases/2000060163,"BAUSCH & LOMB INCORPORATED et al v. AKORN, INC. et al",1:14-cv-01866,D.N.J.,2014, 3/24/2014,0,"8, 12",6780877,1,6780877,http://patft.uspto.gov/netacgi/nph-Parser?patentnumber=6780877,C07D 401/12 (20060101); C07D 401/00 (20060101); A61K 031/445 (); C07D 401/12 (),C07D 401/12 ,C07D 401,3/24/2014,,,,,,,,,,BAUSCH & LOMB INCORPORATED et al,"AKORN, INC. et al",6834,1,1,,,,,,,
2000024387,http://law.lexmachina.com/cases/2000060364,BAUSCH & LOMB INCORPORATED et al v. APOTEX INC. et al,1:14-cv-01975,D.N.J.,2014, 3/28/2014,0,"8, 12",6780877,1,6780877,http://patft.uspto.gov/netacgi/nph-Parser?patentnumber=6780877,C07D 401/12 (20060101); C07D 401/00 (20060101); A61K 031/445 (); C07D 401/12 (),C07D 401/12 ,C07D 401,3/28/2014,,,,,,,,,,BAUSCH & LOMB INCORPORATED et al,APOTEX INC. et al,6834,0,2,,,,,,,
25698,http://law.lexmachina.com/cases/2000068302,Novartis Pharmaceuticals Corporation et al v. Dr. Reddys Laboratories Ltd. et al,1:14-cv-01283,D.Del.,2014, 10/8/2014,0,8,6894051,1,6894051,http://patft.uspto.gov/netacgi/nph-Parser?patentnumber=6894051,C07D 401/00 (20060101); C07D 401/04 (20060101); A61K 031/506 (); C07D 401/14 (),C07D 401/00 ,C07D 401,10/8/2014,,,,,,,,,,Novartis Pharmaceuticals Corporation et al,Dr. Reddys Laboratories Ltd. et al,4299,0,2,,,,,,,
17074,http://law.lexmachina.com/cases/2000065386,"Novartis Pharmaceuticals Corporation et al v. Breckenridge Pharmaceutical, Inc.",1:14-cv-05729,S.D.N.Y.,2014, 7/25/2014,0,8,6894051,1,6894051,http://patft.uspto.gov/netacgi/nph-Parser?patentnumber=6894051,C07D 401/00 (20060101); C07D 401/04 (20060101); A61K 031/506 (); C07D 401/14 (),C07D 401/00 ,C07D 401,7/25/2014,,,,,,,,,,Novartis Pharmaceuticals Corporation et al,"Breckenridge Pharmaceutical, Inc.",4299,0,7,,,,,,,
5360,http://law.lexmachina.com/cases/2000075217,Forest Laboratories LLC et al v. Apotex Inc. et al,1:15-cv-00274,D.Del.,2015, 3/27/2015,0,"8, 12","7834020,8193195,8236804,8673921",4,7834020,http://patft.uspto.gov/netacgi/nph-Parser?patentnumber=7834020,C07D 401/14 (20060101); A61K 31/496 (20060101),C07D 401/14 ,C07D 401,3/27/2015,,,,,,,,,,Forest Laboratories LLC et al,Apotex Inc. et al,6848,0,1,,,,,,,
9427,http://law.lexmachina.com/cases/2000062276,"OTSUKA PHARMACEUTICAL CO., LTD. v. ALEMBIC PHARMACEUTICALS LIMITED",1:14-cv-02982,D.N.J.,2014,  5/9/2014,0,8,"8017615,8518421,8580796,8642760",4,8017615,http://patft.uspto.gov/netacgi/nph-Parser?patentnumber=8017615,C07D 401/06 (20060101); A61K 31/497 (20060101),C07D 401/06 ,C07D 401,5/9/2014,,,,,,,,,,"OTSUKA PHARMACEUTICAL CO., LTD.",ALEMBIC PHARMACEUTICALS LIMITED,4425,1,2,,,,,,,
17094,http://law.lexmachina.com/cases/2000065254,"OTSUKA PHARMACEUTICAL CO., LTD. v. TORRENT PHARMACEUTICALS LIMITED et al",1:14-cv-04671,D.N.J.,2014, 7/25/2014,0,8,"8017615,8580796,8642760,8759350",4,8017615,http://patft.uspto.gov/netacgi/nph-Parser?patentnumber=8017615,C07D 401/06 (20060101); A61K 31/497 (20060101),C07D 401/06 ,C07D 401,7/25/2014,,,,,,,,,,"OTSUKA PHARMACEUTICAL CO., LTD.",TORRENT PHARMACEUTICALS LIMITED et al,4425,0,4,,,,,,,
2000000041,http://law.lexmachina.com/cases/1344,"Pfizer Inc., et al v. Ranbaxy Laboratories, et al",1:03-cv-00209,D.Del.,2003, 2/21/2003,0,8,"4681893,5273995",2,4681893,http://patft.uspto.gov/netacgi/nph-Parser?patentnumber=4681893,C07D 405/06 (20060101); C07D 405/00 (20060101); A61K 031/40 (); A61K 031/35 (); C07D 207/327 (),C07D 405/06 ,C07D 405,2/21/2003,,,,,,,,,,"Pfizer Inc., et al","Ranbaxy Laboratories, et al",4551,0,8,,,,,,,
2000082806,http://law.lexmachina.com/cases/21725,Alcon Manufacturing Ltd. et al v. Barr Laboratories Inc.,1:07-cv-00718,D.Del.,2007, 11/7/2007,0,8,"5116863,5641805",2,5116863,http://patft.uspto.gov/netacgi/nph-Parser?patentnumber=5116863,C07D 405/12 (20060101); C07D 405/00 (20060101); C07D 405/06 (20060101); C07D 313/12 (20060101); C07D 313/00 (20060101); A61K 031/335 (); C07D 313/12 (),C07D 405/12 ,C07D 405,11/7/2007,,,,,,,,,,Alcon Manufacturing Ltd. et al,Barr Laboratories Inc.,1701,1,0,,,,,,,
2000062833,http://law.lexmachina.com/cases/2000063308,"GILEAD SCIENCES, INC. et al v. Mylan Inc. et al",1:14-cv-00099,N.D.W.Va.,2014,  6/9/2014,0,"8, 12","5210085,5814639,6642245,6703396,8592397,8716264",6,5210085,http://patft.uspto.gov/netacgi/nph-Parser?patentnumber=5210085,C07D 405/00 (20060101); C07D 405/04 (20060101); C07D 411/04 (20060101); C07D 327/00 (20060101); C07D 411/00 (20060101); C07D 327/04 (20060101); C07H 19/06 (20060101); C07H 19/00 (20060101); C07H 19/10 (20060101); A61K 031/505 (); C07D 411/04 (),C07D 405/00 ,C07D 405,6/9/2014,,,,,,,,,,"GILEAD SCIENCES, INC. et al",Mylan Inc. et al,6850,0,2,,,,,,,
2000038854,http://law.lexmachina.com/cases/2000005337,Pfizer Inc. et al v. Sandoz Inc.,1:11-cv-00023,D.Del.,2011,  1/6/2011,0,8,"5364938,6632803",2,5364938,http://patft.uspto.gov/netacgi/nph-Parser?patentnumber=5364938,C07D 405/06 (20060101); C07D 237/08 (20060101); C07D 239/00 (20060101); C07D 237/00 (20060101); C07D 239/26 (20060101); C07D 213/00 (20060101); C07D 241/00 (20060101); C07D 241/12 (20060101); C07D 405/00 (20060101); C07D 213/30 (20060101); C07D 213/50 (20060101); C07D 521/00 (20060101); C07D 403/10 (),C07D 405/06 ,C07D 405,1/6/2011,,,,,,,,,,Pfizer Inc. et al,Sandoz Inc.,4547,0,7,,,,,,,
2000069485,http://law.lexmachina.com/cases/2000037688,"Gilead Sciences, Inc., et al v. Lupin Limited",1:12-cv-06293,S.D.N.Y.,2012, 8/16/2012,0,8,"5814639,5914331,6642245,6703396",4,5814639,http://patft.uspto.gov/netacgi/nph-Parser?patentnumber=5814639,C07D 405/00 (20060101); C07D 405/04 (20060101); C07D 411/04 (20060101); C07D 411/00 (20060101); C07D 327/04 (20060101); C07D 327/00 (20060101); C07H 19/06 (20060101); C07H 19/10 (20060101); C07H 19/00 (20060101); A61K 031/505 (); C07D 239/02 (),C07D 405/00 ,C07D 405,8/16/2012,,,,,,,,,,"Gilead Sciences, Inc., et al",Lupin Limited,3134,1,0,,,,,,,
25337,http://law.lexmachina.com/cases/2000061275,"Kowa Company, Ltd. et al v. Zydus Pharmaceuticals (USA) Inc. et al",1:14-cv-02760,S.D.N.Y.,2014, 4/17/2014,0,8,"5856336,6465477,8557993",3,5856336,http://patft.uspto.gov/netacgi/nph-Parser?patentnumber=5856336,C07D 405/00 (20060101); C07D 405/06 (20060101); C07D 215/14 (20060101); C07D 215/20 (20060101); C07D 215/18 (20060101); C07D 215/00 (20060101); A61K 031/47 (); C07D 215/12 (),C07D 405/00 ,C07D 405,4/17/2014,,,,,,,,,,"Kowa Company, Ltd. et al",Zydus Pharmaceuticals (USA) Inc. et al,3688,0,2,,,,,,,
2000057467,http://law.lexmachina.com/cases/2000061270,"KOWA COMPANY, LTD. et al v. AMNEAL PHARMACEUTICALS, LLC",3:14-cv-02488,D.N.J.,2014, 4/18/2014,0,8,"5856336,8557993",2,5856336,http://patft.uspto.gov/netacgi/nph-Parser?patentnumber=5856336,C07D 405/00 (20060101); C07D 405/06 (20060101); C07D 215/14 (20060101); C07D 215/20 (20060101); C07D 215/18 (20060101); C07D 215/00 (20060101); A61K 031/47 (); C07D 215/12 (),C07D 405/00 ,C07D 405,4/18/2014,,,,,,,,,,"KOWA COMPANY, LTD. et al","AMNEAL PHARMACEUTICALS, LLC",3687,1,1,,,,,,,
2000028185,http://law.lexmachina.com/cases/2000061350,"KOWA COMPANY, LTD. et al v. ZYDUS PHARMACEUTICALS (USA) INC. et al",3:14-cv-02552,D.N.J.,2014, 4/22/2014,0,8,"5856336,6465477,8557993",3,5856336,http://patft.uspto.gov/netacgi/nph-Parser?patentnumber=5856336,C07D 405/00 (20060101); C07D 405/06 (20060101); C07D 215/14 (20060101); C07D 215/20 (20060101); C07D 215/18 (20060101); C07D 215/00 (20060101); A61K 031/47 (); C07D 215/12 (),C07D 405/00 ,C07D 405,4/22/2014,,,,,,,,,,"KOWA COMPANY, LTD. et al",ZYDUS PHARMACEUTICALS (USA) INC. et al,3688,0,2,,,,,,,
