LMIcaseid,URL,Casetitle,Civilaction,Venue,YearFiled,Filingdate,Declaratoryjudgment,NPECode,Patents,# Of Patents,PrimaryPatent,IPC Url ,IPC,PrimaryClass,First4level,Filingdate1,B4,B3,B2,B1,Q0,A1,A2,A3,A4,Casetitle1,Casetitle2,y,tag,dup,,,,,,,
No Patents Available (On Lex Machina),,,,,,,,,,,,,,,,,,,,,,,,,,,,,,,,,,,,,
1000,http://law.lexmachina.com/cases/1000,Cognex Corporation v. Natl Instruments,1:00-cv-00442,D.Del.,2000,  5/2/2000,0,8,No Patents Available from Lex Machina,,,,,,,5/2/2000,Not Available,,,,,,,,,Cognex Corporation,Natl Instruments,2423,0,1,,,,,,,
10000,http://law.lexmachina.com/cases/10000,"Ivoclar Vivadent,, et al v. Dental/Medical",1:01-cv-00121,W.D.N.Y.,2001, 2/16/2001,0,8,No Patents Available from Lex Machina,,,,,,,2/16/2001,Not Available,,,,,,,,,"Ivoclar Vivadent,, et al",Dental/Medical,3549,1,0,,,,,,,
1000000002,http://law.lexmachina.com/cases/1000000002,"Yakima Products Inc v. Industri Ab Thule, et al",3:00-cv-00024,N.D.Cal.,2000,  1/4/2000,0,8,No Patents Available from Lex Machina,,,,,,,1/4/2000,Not Available,,,,,,,,,Yakima Products Inc,"Industri Ab Thule, et al",5972,1,0,,,,,,,
1000000010,http://law.lexmachina.com/cases/1000000010,Trans Industrial v. Time Warner Inc.,3:00-cv-00757,N.D.Cal.,2000,  3/2/2000,0,8,No Patents Available from Lex Machina,,,,,,,3/2/2000,Not Available,,,,,,,,,Trans Industrial,Time Warner Inc.,5565,1,0,,,,,,,
1000000021,http://law.lexmachina.com/cases/1000000021,"Senetek PLC, et al v. Ortega",3:00-cv-01020,N.D.Cal.,2000, 3/23/2000,0,8,No Patents Available from Lex Machina,,,,,,,3/23/2000,Not Available,,,,,,,,,"Senetek PLC, et al",Ortega,5006,1,0,,,,,,,
1000000025,http://law.lexmachina.com/cases/1000000025,Informix Software v. International Bus.,3:00-cv-01095,N.D.Cal.,2000, 3/28/2000,0,8,No Patents Available from Lex Machina,,,,,,,3/28/2000,Not Available,,,,,,,,,Informix Software,International Bus.,3453,1,0,,,,,,,
1000000030,http://law.lexmachina.com/cases/1000000030,"Simpson, et al v. Baer, et al",3:00-cv-01241,N.D.Cal.,2000, 4/10/2000,0,"8, 9",No Patents Available from Lex Machina,,,,,,,4/10/2000,Not Available,,,,,,,,,"Simpson, et al","Baer, et al",7118,1,0,,,,,,,
1000000038,http://law.lexmachina.com/cases/1000000038,"Stenosync, Inc. v. Barkley, et al",3:00-cv-01786,N.D.Cal.,2000, 5/17/2000,0,7,No Patents Available from Lex Machina,,,,,,,5/17/2000,Not Available,,,,,,,,,"Stenosync, Inc.","Barkley, et al",1537,1,0,,,,,,,
1000000039,http://law.lexmachina.com/cases/1000000039,"Business Objects v. Cognos Incorporated, et al",3:00-cv-01816,N.D.Cal.,2000,  5/5/2000,0,8,No Patents Available from Lex Machina,,,,,,,5/5/2000,Not Available,,,,,,,,,Business Objects,"Cognos Incorporated, et al",2235,1,0,,,,,,,
1000000046,http://law.lexmachina.com/cases/1000000046,Workrite Ergonomic v. Ergonomic Concepts,3:00-cv-02023,N.D.Cal.,2000,  6/6/2000,0,8,No Patents Available from Lex Machina,,,,,,,6/6/2000,Not Available,,,,,,,,,Workrite Ergonomic,Ergonomic Concepts,5934,1,0,,,,,,,
1000000050,http://law.lexmachina.com/cases/1000000050,"E-Y Labs, Inc. v. Tao",3:00-cv-02293,N.D.Cal.,2000, 6/28/2000,0,8,No Patents Available from Lex Machina,,,,,,,6/28/2000,Not Available,,,,,,,,,"E-Y Labs, Inc.",Tao,2903,1,0,,,,,,,
1000000053,http://law.lexmachina.com/cases/1000000053,Dantz Development v. Omni Development Inc,3:00-cv-02389,N.D.Cal.,2000,  7/6/2000,0,8,No Patents Available from Lex Machina,,,,,,,7/6/2000,Not Available,,,,,,,,,Dantz Development,Omni Development Inc,2570,1,0,,,,,,,
1000000059,http://law.lexmachina.com/cases/1000000059,"Osmotics Corporation v. Senetek PLC, et al",3:00-cv-02747,N.D.Cal.,2000,  8/2/2000,0,8,No Patents Available from Lex Machina,,,,,,,8/2/2000,Not Available,,,,,,,,,Osmotics Corporation,"Senetek PLC, et al",4413,1,0,,,,,,,
1000000061,http://law.lexmachina.com/cases/1000000061,"Service911.com, Inc v. Software911, Inc.",3:00-cv-02897,N.D.Cal.,2000, 8/11/2000,0,8,No Patents Available from Lex Machina,,,,,,,8/11/2000,Not Available,,,,,,,,,"Service911.com, Inc","Software911, Inc.",5021,1,0,,,,,,,
1000000065,http://law.lexmachina.com/cases/1000000065,"Sunrace Roots Ent Co, et al v. Sram Corporation",3:00-cv-03217,N.D.Cal.,2000,  9/6/2000,0,8,No Patents Available from Lex Machina,,,,,,,9/6/2000,Not Available,,,,,,,,,"Sunrace Roots Ent Co, et al",Sram Corporation,5295,1,0,,,,,,,
1000000073,http://law.lexmachina.com/cases/1000000073,"Integrated Circuit v. Realtek Semiconduct, et al",3:00-cv-04035,N.D.Cal.,2000, 11/1/2000,0,8,No Patents Available from Lex Machina,,,,,,,11/1/2000,Not Available,,,,,,,,,Integrated Circuit,"Realtek Semiconduct, et al",3478,1,0,,,,,,,
1000000077,http://law.lexmachina.com/cases/1000000077,Cal West Specialty v. Aqua-Tec Coating,3:00-cv-04411,N.D.Cal.,2000,11/27/2000,0,8,No Patents Available from Lex Machina,,,,,,,11/27/2000,Not Available,,,,,,,,,Cal West Specialty,Aqua-Tec Coating,2253,1,0,,,,,,,
1000000080,http://law.lexmachina.com/cases/1000000080,"Incyte Genomics, Inc v. Gene Logic, Inc.",3:00-cv-04627,N.D.Cal.,2000, 8/17/2000,0,8,No Patents Available from Lex Machina,,,,,,,8/17/2000,Not Available,,,,,,,,,"Incyte Genomics, Inc","Gene Logic, Inc.",3436,1,0,,,,,,,
1000000092,http://law.lexmachina.com/cases/1000000092,"Composite Rotor, Inc, et al v. Beckman Couler, Inc., et al",3:01-cv-02258,N.D.Cal.,2000,  8/2/2000,0,8,No Patents Available from Lex Machina,,,,,,,8/2/2000,Not Available,,,,,,,,,"Composite Rotor, Inc, et al","Beckman Couler, Inc., et al",2447,1,0,,,,,,,
1000000099,http://law.lexmachina.com/cases/1000000099,"Unisys Corporation v. Actel Corporation, et al",4:00-cv-01114,N.D.Cal.,2000, 3/29/2000,0,8,No Patents Available from Lex Machina,,,,,,,3/29/2000,Not Available,,,,,,,,,Unisys Corporation,"Actel Corporation, et al",5666,1,0,,,,,,,
1000000100,http://law.lexmachina.com/cases/1000000100,"Freedom Wireless Inc v. Boston Communication, et al",4:00-cv-01129,N.D.Cal.,2000, 3/30/2000,0,5,No Patents Available from Lex Machina,,,,,,,3/30/2000,Not Available,,,,,,,,,Freedom Wireless Inc,"Boston Communication, et al",1087,1,0,,,,,,,
1000000102,http://law.lexmachina.com/cases/1000000102,Dolby Lab. Licensing v. Compal Electronics,3:00-cv-04542,N.D.Cal.,2000, 12/5/2000,0,12,No Patents Available from Lex Machina,,,,,,,12/5/2000,Not Available,,,,,,,,,Dolby Lab. Licensing,Compal Electronics,6531,1,0,,,,,,,
1000000106,http://law.lexmachina.com/cases/1000000106,"Rambus Inc. v. Hitachi LTD, et al",4:00-cv-01716,N.D.Cal.,2000, 4/21/2000,0,1,No Patents Available from Lex Machina,,,,,,,4/21/2000,Not Available,,,,,,,,,Rambus Inc.,"Hitachi LTD, et al",627,1,2,,,,,,,
1000000115,http://law.lexmachina.com/cases/1000000115,"Hitachi, Ltd. v. Nanya Technology, et al",4:00-cv-02891,N.D.Cal.,2000, 8/11/2000,0,8,No Patents Available from Lex Machina,,,,,,,8/11/2000,Not Available,,,,,,,,,"Hitachi, Ltd.","Nanya Technology, et al",3304,1,1,,,,,,,
1000000119,http://law.lexmachina.com/cases/1000000119,"Digital Island, Inc. v. Akamai Technologies",4:00-cv-03782,N.D.Cal.,2000, 9/18/2000,0,8,No Patents Available from Lex Machina,,,,,,,9/18/2000,Not Available,,,,,,,,,"Digital Island, Inc.",Akamai Technologies,2643,1,0,,,,,,,
1000000122,http://law.lexmachina.com/cases/1000000122,"United Microelectron, et al v. Silicon Integrated, et al",4:00-cv-04522,N.D.Cal.,2000, 12/4/2000,0,8,No Patents Available from Lex Machina,,,,,,,12/4/2000,Not Available,,,,,,,,,"United Microelectron, et al","Silicon Integrated, et al",5669,1,0,,,,,,,
1000000128,http://law.lexmachina.com/cases/1000000128,"Replay TV, Inc. v. Phonetel",5:00-cv-20207,N.D.Cal.,2000, 2/23/2000,1,1,No Patents Available from Lex Machina,,,,,,,2/23/2000,Not Available,,,,,,,,,"Replay TV, Inc.",Phonetel,642,1,0,,,,,,,
1000000133,http://law.lexmachina.com/cases/1000000133,"Exar Corporation v. Oxford Semiconductor, et al",5:00-cv-20362,N.D.Cal.,2000, 1/27/2000,0,8,No Patents Available from Lex Machina,,,,,,,1/27/2000,Not Available,,,,,,,,,Exar Corporation,"Oxford Semiconductor, et al",2892,1,0,,,,,,,
1000000134,http://law.lexmachina.com/cases/1000000134,Agen Biomedical Ltd. v. Biopool Internationl,5:00-cv-20466,N.D.Cal.,2000, 3/10/2000,0,8,No Patents Available from Lex Machina,,,,,,,3/10/2000,Not Available,,,,,,,,,Agen Biomedical Ltd.,Biopool Internationl,1659,1,0,,,,,,,
1000000143,http://law.lexmachina.com/cases/1000000143,Teledyne Lighting v. Kopin Corporation,5:00-cv-20762,N.D.Cal.,2000, 7/14/2000,0,8,No Patents Available from Lex Machina,,,,,,,7/14/2000,Not Available,,,,,,,,,Teledyne Lighting,Kopin Corporation,5407,1,0,,,,,,,
1000000148,http://law.lexmachina.com/cases/1000000148,"Methode Electronics, et al v. Hewlett-Packard Co, et al",5:00-cv-20985,N.D.Cal.,2000, 9/11/2000,0,8,No Patents Available from Lex Machina,,,,,,,9/11/2000,Not Available,,,,,,,,,"Methode Electronics, et al","Hewlett-Packard Co, et al",4021,0,1,,,,,,,
1000000153,http://law.lexmachina.com/cases/1000000153,"Dolby Laboratories, et al v. Lucent Technologies",5:00-cv-21270,N.D.Cal.,2000,12/19/2000,0,"8, 12",No Patents Available from Lex Machina,,,,,,,12/19/2000,Not Available,,,,,,,,,"Dolby Laboratories, et al",Lucent Technologies,6843,1,0,,,,,,,
1000000155,http://law.lexmachina.com/cases/1000000155,"United Micro, et al v. U.S. International, et al",5:01-cv-20118,N.D.Cal.,2000,12/15/2000,0,8,No Patents Available from Lex Machina,,,,,,,12/15/2000,Not Available,,,,,,,,,"United Micro, et al","U.S. International, et al",5668,1,0,,,,,,,
1000000165,http://law.lexmachina.com/cases/1000000165,"FCI USA Inc., et al v. Foxconn Intl, et al",3:01-cv-01192,N.D.Cal.,2001, 3/23/2001,0,"8, 12",No Patents Available from Lex Machina,,,,,,,3/23/2001,Not Available,,,,,,,,,"FCI USA Inc., et al","Foxconn Intl, et al",6847,1,0,,,,,,,
1000000175,http://law.lexmachina.com/cases/1000000175,Alderman v. Bristol-Myers Squibb Co.,3:01-cv-01615,N.D.Cal.,2001, 4/24/2001,0,9,No Patents Available from Lex Machina,,,,,,,4/24/2001,Not Available,,,,,,,,,Alderman,Bristol-Myers Squibb Co.,6034,1,0,,,,,,,
1000000178,http://law.lexmachina.com/cases/1000000178,"ATMI, Inc. et al v. Innovative Engineering Solutions, Inc.",3:01-cv-01729,N.D.Cal.,2001,  5/3/2001,0,8,No Patents Available from Lex Machina,,,,,,,5/3/2001,Not Available,,,,,,,,,"ATMI, Inc. et al","Innovative Engineering Solutions, Inc.",1956,1,0,,,,,,,
1000000182,http://law.lexmachina.com/cases/1000000182,"Logitech Inc. v. Par Technologies, Inc.",3:01-cv-01983,N.D.Cal.,2001, 5/21/2001,1,8,No Patents Available from Lex Machina,,,,,,,5/21/2001,Not Available,,,,,,,,,Logitech Inc.,"Par Technologies, Inc.",3823,1,0,,,,,,,
1000000190,http://law.lexmachina.com/cases/1000000190,"Giga Semiconductor, Inc. v. Integrated Device Technology, Inc.",3:01-cv-02368,N.D.Cal.,2001, 6/20/2001,1,8,No Patents Available from Lex Machina,,,,,,,6/20/2001,Not Available,,,,,,,,,"Giga Semiconductor, Inc.","Integrated Device Technology, Inc.",3131,1,0,,,,,,,
1000000212,http://law.lexmachina.com/cases/1000000212,Motion Sense Corporation v. Vega Vista Inc.,3:01-cv-03984,N.D.Cal.,2001,10/23/2001,0,8,No Patents Available from Lex Machina,,,,,,,10/23/2001,Not Available,,,,,,,,,Motion Sense Corporation,Vega Vista Inc.,4123,1,0,,,,,,,
1000000213,http://law.lexmachina.com/cases/1000000213,"WRB Company, Inc. v. TT Technologies, Inc.",3:01-cv-03992,N.D.Cal.,2001,10/23/2001,0,8,No Patents Available from Lex Machina,,,,,,,10/23/2001,Not Available,,,,,,,,,"WRB Company, Inc.","TT Technologies, Inc.",5951,1,0,,,,,,,
1000000214,http://law.lexmachina.com/cases/1000000214,"Cogliano v. Toys R Us, Inc.",3:01-cv-04013,N.D.Cal.,2001,10/25/2001,0,9,No Patents Available from Lex Machina,,,,,,,10/25/2001,Not Available,,,,,,,,,Cogliano,"Toys R Us, Inc.",6105,1,0,,,,,,,
1000000220,http://law.lexmachina.com/cases/1000000220,Vigil v. Walt Disney Company et al,3:01-cv-04250,N.D.Cal.,2001,11/14/2001,0,9,No Patents Available from Lex Machina,,,,,,,11/14/2001,Not Available,,,,,,,,,Vigil,Walt Disney Company et al,6468,0,2,,,,,,,
1000000221,http://law.lexmachina.com/cases/1000000221,ECast Inc. v. Touchtunes Music Corporation,3:01-cv-04298,N.D.Cal.,2001,11/16/2001,0,8,No Patents Available from Lex Machina,,,,,,,11/16/2001,Not Available,,,,,,,,,ECast Inc.,Touchtunes Music Corporation,2770,1,0,,,,,,,
1000000224,http://law.lexmachina.com/cases/1000000224,Tumbleweed Communications Corp v. American Greetings Corporation,3:01-cv-04676,N.D.Cal.,2001, 12/3/2001,0,8,No Patents Available from Lex Machina,,,,,,,12/3/2001,Not Available,,,,,,,,,Tumbleweed Communications Corp,American Greetings Corporation,5622,1,1,,,,,,,
1000000225,http://law.lexmachina.com/cases/1000000225,"Mindfabric, Inc. v. Primus Knowledge Solutions, Inc.",3:01-cv-04703,N.D.Cal.,2001, 12/4/2001,0,8,No Patents Available from Lex Machina,,,,,,,12/4/2001,Not Available,,,,,,,,,"Mindfabric, Inc.","Primus Knowledge Solutions, Inc.",4071,1,0,,,,,,,
1000000230,http://law.lexmachina.com/cases/1000000230,"Lumenis, Inc. v. Altus Medical, Inc.",3:01-cv-05370,N.D.Cal.,2001,12/27/2001,0,8,No Patents Available from Lex Machina,,,,,,,12/27/2001,Not Available,,,,,,,,,"Lumenis, Inc.","Altus Medical, Inc.",3840,1,0,,,,,,,
1000000231,http://law.lexmachina.com/cases/1000000231,"Getters v. Aeronex, Inc.",3:01-cv-05457,N.D.Cal.,2001,12/28/2001,0,8,No Patents Available from Lex Machina,,,,,,,12/28/2001,Not Available,,,,,,,,,Getters,"Aeronex, Inc.",3127,1,0,,,,,,,
1000000248,http://law.lexmachina.com/cases/1000000248,"Avigen,Inc. v. Research Corporation Technologies,Inc.,",3:02-cv-00880,N.D.Cal.,2002, 2/21/2002,0,8,No Patents Available from Lex Machina,,,,,,,2/21/2002,Not Available,,,,,,,,,"Avigen,Inc.","Research Corporation Technologies,Inc.,",1999,1,0,,,,,,,
1000000255,http://law.lexmachina.com/cases/1000000255,"ABB Automation Inc., v. Honeywell Corporation",3:02-cv-01526,N.D.Cal.,2002, 3/29/2002,0,8,No Patents Available from Lex Machina,,,,,,,3/29/2002,Not Available,,,,,,,,,"ABB Automation Inc.,",Honeywell Corporation,1572,1,0,,,,,,,
1000000257,http://law.lexmachina.com/cases/1000000257,"Leapfrog Enterprises, Inc. v. Franklin Electronic Publishers, Inc.",3:02-cv-01676,N.D.Cal.,2002,  4/8/2002,0,8,No Patents Available from Lex Machina,,,,,,,4/8/2002,Not Available,,,,,,,,,"Leapfrog Enterprises, Inc.","Franklin Electronic Publishers, Inc.",3735,1,0,,,,,,,
1000000259,http://law.lexmachina.com/cases/1000000259,"Radiotherapeutics Corporation et al v. Rita Medical Systems, Inc.",3:02-cv-01745,N.D.Cal.,2002, 4/11/2002,0,"6, 8",No Patents Available from Lex Machina,,,,,,,4/11/2002,Not Available,,,,,,,,,Radiotherapeutics Corporation et al,"Rita Medical Systems, Inc.",6790,1,1,,,,,,,
1000000271,http://law.lexmachina.com/cases/1000000271,"Good Technology, Inc. v. Research In Motion Corporation et al",3:02-cv-02348,N.D.Cal.,2002, 5/15/2002,0,8,No Patents Available from Lex Machina,,,,,,,5/15/2002,Not Available,,,,,,,,,"Good Technology, Inc.",Research In Motion Corporation et al,3177,1,0,,,,,,,
1000000273,http://law.lexmachina.com/cases/1000000273,Propat International Corp v. RPost Inc. et al,3:02-cv-02473,N.D.Cal.,2002, 5/21/2002,0,1,No Patents Available from Lex Machina,,,,,,,5/21/2002,Not Available,,,,,,,,,Propat International Corp,RPost Inc. et al,612,1,1,,,,,,,
1000000282,http://law.lexmachina.com/cases/1000000282,"Gateway Inc. v. Electronics for Imaging, Inc. et al",3:02-cv-03085,N.D.Cal.,2002, 6/27/2002,0,8,No Patents Available from Lex Machina,,,,,,,6/27/2002,Not Available,,,,,,,,,Gateway Inc.,"Electronics for Imaging, Inc. et al",3082,1,0,,,,,,,
1000000303,http://law.lexmachina.com/cases/1000000303,Vigil v. The Walt Disney Company et al,3:02-cv-04002,N.D.Cal.,2002, 8/19/2002,0,9,No Patents Available from Lex Machina,,,,,,,8/19/2002,Not Available,,,,,,,,,Vigil,The Walt Disney Company et al,6468,1,1,,,,,,,
1000000306,http://law.lexmachina.com/cases/1000000306,"Fresh Express, Incorporated v. Diamond Produce, LLC",3:02-cv-04192,N.D.Cal.,2002,  9/3/2002,0,8,No Patents Available from Lex Machina,,,,,,,9/3/2002,Not Available,,,,,,,,,"Fresh Express, Incorporated","Diamond Produce, LLC",3041,1,0,,,,,,,
1000000314,http://law.lexmachina.com/cases/1000000314,"Nellcor Puritan Bennett, Inc. et al v. Sensidyne Inc.",3:02-cv-04622,N.D.Cal.,2002, 9/24/2002,0,8,No Patents Available from Lex Machina,,,,,,,9/24/2002,Not Available,,,,,,,,,"Nellcor Puritan Bennett, Inc. et al",Sensidyne Inc.,4200,0,2,,,,,,,
1000000323,http://law.lexmachina.com/cases/1000000323,"Radiotherapeutics Corporation et al v. Rita Medical Systems, Inc.",3:02-cv-05005,N.D.Cal.,2002,10/16/2002,0,"6, 8",No Patents Available from Lex Machina,,,,,,,10/16/2002,Not Available,,,,,,,,,Radiotherapeutics Corporation et al,"Rita Medical Systems, Inc.",6790,0,2,,,,,,,
1000000325,http://law.lexmachina.com/cases/1000000325,"USA Products Group, Inc. v. Eurow Corporation et al",3:02-cv-05072,N.D.Cal.,2002,10/18/2002,0,8,No Patents Available from Lex Machina,,,,,,,10/18/2002,Not Available,,,,,,,,,"USA Products Group, Inc.",Eurow Corporation et al,5697,1,0,,,,,,,
1000000346,http://law.lexmachina.com/cases/1000000346,"Sharper Image Corporation et al v. Brookstone Company, Inc.",3:02-cv-05817,N.D.Cal.,2002,12/13/2002,0,8,No Patents Available from Lex Machina,,,,,,,12/13/2002,Not Available,,,,,,,,,Sharper Image Corporation et al,"Brookstone Company, Inc.",5034,1,2,,,,,,,
1000000347,http://law.lexmachina.com/cases/1000000347,"EZ Environmental Solutions, Corp. v. Petter Investments, Inc.",3:02-cv-05822,N.D.Cal.,2002,12/13/2002,0,8,No Patents Available from Lex Machina,,,,,,,12/13/2002,Not Available,,,,,,,,,"EZ Environmental Solutions, Corp.","Petter Investments, Inc.",2906,1,0,,,,,,,
1000000349,http://law.lexmachina.com/cases/1000000349,Boston Scientific Corporation et al v. Guidant Corporation Inc et al,3:02-cv-05969,N.D.Cal.,2002,12/30/2002,0,8,No Patents Available from Lex Machina,,,,,,,12/30/2002,Not Available,,,,,,,,,Boston Scientific Corporation et al,Guidant Corporation Inc et al,2184,0,1,,,,,,,
1000000461,http://law.lexmachina.com/cases/1000000461,"FusionOne, Inc. v. NCR Corporation",3:04-cv-00182,N.D.Cal.,2004, 1/13/2004,0,8,No Patents Available from Lex Machina,,,,,,,1/13/2004,Not Available,,,,,,,,,"FusionOne, Inc.",NCR Corporation,3061,1,0,,,,,,,
1000000485,http://law.lexmachina.com/cases/1000000485,"Seven Networks, Inc. v. Visto Corporation",3:04-cv-01641,N.D.Cal.,2004, 4/27/2004,1,8,No Patents Available from Lex Machina,,,,,,,4/27/2004,Not Available,,,,,,,,,"Seven Networks, Inc.",Visto Corporation,5024,1,0,,,,,,,
1000000489,http://law.lexmachina.com/cases/1000000489,Genentech Inc. v. Trustees of Columbia University in the City of New York,3:04-cv-01910,N.D.Cal.,2004, 5/14/2004,1,6,No Patents Available from Lex Machina,,,,,,,5/14/2004,Not Available,,,,,,,,,Genentech Inc.,Trustees of Columbia University in the City of New York,1500,1,0,,,,,,,
1000000518,http://law.lexmachina.com/cases/1000000518,"Lonestar Inventions, L.P. v. Marvell Semiconductor Inc. et al",3:04-cv-03297,N.D.Cal.,2004, 8/12/2004,0,5,No Patents Available from Lex Machina,,,,,,,8/12/2004,Not Available,,,,,,,,,Lonestar Inventions L.P.,Marvell Semiconductor Inc. et al,1212,1,0,,,,,,,
1000000623,http://law.lexmachina.com/cases/1000000623,"OKeeffes, Inc. v. Allco Millwork et al",3:05-cv-02715,N.D.Cal.,2005,  7/1/2005,0,8,No Patents Available from Lex Machina,,,,,,,7/1/2005,Not Available,,,,,,,,,"OKeeffes, Inc.",Allco Millwork et al,4341,1,0,,,,,,,
1000000666,http://law.lexmachina.com/cases/1000000666,Toshiba Corporation v. Hynix Semiconductor Inc. et al,3:05-cv-04547,N.D.Cal.,2005, 11/7/2005,0,8,No Patents Available from Lex Machina,,,,,,,11/7/2005,Not Available,,,,,,,,,Toshiba Corporation,Hynix Semiconductor Inc. et al,5551,1,2,,,,,,,
1000000683,http://law.lexmachina.com/cases/1000000683,Food.com Inc v. Papa Johns Intl,4:01-cv-00269,N.D.Cal.,2001, 1/16/2001,0,7,No Patents Available from Lex Machina,,,,,,,1/16/2001,Not Available,,,,,,,,,Food.com Inc,Papa Johns Intl,1531,1,0,,,,,,,
1000000706,http://law.lexmachina.com/cases/1000000706,"Tumbleweed Communications Corp. v. Hallmark Cards, Incorporated",4:01-cv-04675,N.D.Cal.,2001, 12/3/2001,0,8,No Patents Available from Lex Machina,,,,,,,12/3/2001,Not Available,,,,,,,,,Tumbleweed Communications Corp.,"Hallmark Cards, Incorporated",5623,1,2,,,,,,,
1000000726,http://law.lexmachina.com/cases/1000000726,"IP Learn, LLC. v. SumTotal Systems, Inc.",4:02-cv-02636,N.D.Cal.,2002, 5/31/2002,0,5,No Patents Available from Lex Machina,,,,,,,5/31/2002,Not Available,,,,,,,,,"IP Learn, LLC.","SumTotal Systems, Inc.",1155,0,2,,,,,,,
1000000733,http://law.lexmachina.com/cases/1000000733,OHagins Inc v. M5 Steel Mfg. Inc.,4:02-cv-04532,N.D.Cal.,2002, 9/17/2002,0,8,No Patents Available from Lex Machina,,,,,,,9/17/2002,Not Available,,,,,,,,,OHagins Inc,M5 Steel Mfg. Inc.,4336,1,0,,,,,,,
1000000739,http://law.lexmachina.com/cases/1000000739,"PNI Corporation v. Zensys USA, Inc.",4:02-cv-05279,N.D.Cal.,2002, 11/1/2002,0,8,No Patents Available from Lex Machina,,,,,,,11/1/2002,Not Available,,,,,,,,,PNI Corporation,"Zensys USA, Inc.",4597,0,2,,,,,,,
1000000749,http://law.lexmachina.com/cases/1000000749,"Epistar Corporation v. Lumileds Lighting US, LLC",4:03-cv-01130,N.D.Cal.,2003, 3/17/2003,0,8,No Patents Available from Lex Machina,,,,,,,3/17/2003,Not Available,,,,,,,,,Epistar Corporation,"Lumileds Lighting US, LLC",2861,1,0,,,,,,,
1000000759,http://law.lexmachina.com/cases/1000000759,"PCTEL, Inc. v. 3COM Corporation",4:03-cv-03124,N.D.Cal.,2003,  7/3/2003,0,8,No Patents Available from Lex Machina,,,,,,,7/3/2003,Not Available,,,,,,,,,"PCTEL, Inc.",3COM Corporation,4512,1,1,,,,,,,
1000000812,http://law.lexmachina.com/cases/1000000812,"Methode Electronics, et al v. Finisar Corporation",5:01-cv-00268,N.D.Cal.,2001, 1/16/2001,0,8,No Patents Available from Lex Machina,,,,,,,1/16/2001,Not Available,,,,,,,,,"Methode Electronics, et al",Finisar Corporation,4021,1,2,,,,,,,
1000000817,http://law.lexmachina.com/cases/1000000817,"Nidek Co., LTD v. VISX, Incorporated",5:01-cv-20015,N.D.Cal.,2001,  1/8/2001,0,8,No Patents Available from Lex Machina,,,,,,,1/8/2001,Not Available,,,,,,,,,"Nidek Co., LTD","VISX, Incorporated",4257,1,0,,,,,,,
1000000818,http://law.lexmachina.com/cases/1000000818,"Seiko Epson Corp v. ADI Systems, Inc., et al",5:01-cv-20051,N.D.Cal.,2001, 1/19/2001,0,8,No Patents Available from Lex Machina,,,,,,,1/19/2001,Not Available,,,,,,,,,Seiko Epson Corp,"ADI Systems, Inc., et al",4993,1,0,,,,,,,
1000000821,http://law.lexmachina.com/cases/1000000821,Tan v. Trapp,5:01-cv-20241,N.D.Cal.,2001, 3/21/2001,0,9,No Patents Available from Lex Machina,,,,,,,3/21/2001,Not Available,,,,,,,,,Tan,Trapp,6447,0,2,,,,,,,
1000000840,http://law.lexmachina.com/cases/1000000840,"IT Concepts, LLC v. Advanced Dental Imaging, Inc.",5:01-cv-21052,N.D.Cal.,2001, 8/24/2001,0,8,No Patents Available from Lex Machina,,,,,,,8/24/2001,Not Available,,,,,,,,,"IT Concepts, LLC","Advanced Dental Imaging, Inc.",3542,1,0,,,,,,,
1000000847,http://law.lexmachina.com/cases/1000000847,Cygnus Telecommunications Technology v. Dial-Thru International,5:02-cv-00142,N.D.Cal.,2002,  1/9/2002,0,1,No Patents Available from Lex Machina,,,,,,,1/9/2002,Not Available,,,,,,,,,Cygnus Telecommunications Technology,Dial-Thru International,186,0,9,,,,,,,
1000000849,http://law.lexmachina.com/cases/1000000849,"Cygnus Telecommunications Technology v. Worldport Communications, Inc. et al",5:02-cv-00144,N.D.Cal.,2002,  1/9/2002,0,1,No Patents Available from Lex Machina,,,,,,,1/9/2002,Not Available,,,,,,,,,Cygnus Telecommunications Technology,"Worldport Communications, Inc. et al",186,0,3,,,,,,,
1000000855,http://law.lexmachina.com/cases/1000000855,"Cygnus Telecommunications Technology v. Ptek Holdings, Inc.",5:02-cv-00150,N.D.Cal.,2002,  1/9/2002,0,1,No Patents Available from Lex Machina,,,,,,,1/9/2002,Not Available,,,,,,,,,Cygnus Telecommunications Technology,"Ptek Holdings, Inc.",186,0,6,,,,,,,
1000000859,http://law.lexmachina.com/cases/1000000859,"Cygnus Telecommunications Technology v. Intercontinental Exchange, Inc. et al",5:02-cv-00559,N.D.Cal.,2002, 1/31/2002,0,1,No Patents Available from Lex Machina,,,,,,,1/31/2002,Not Available,,,,,,,,,Cygnus Telecommunications Technology,"Intercontinental Exchange, Inc. et al",186,0,4,,,,,,,
1000000873,http://law.lexmachina.com/cases/1000000873,"Cybon, Inc. v. Z-Kat, Inc.",5:02-cv-03475,N.D.Cal.,2002, 7/19/2002,1,1,No Patents Available from Lex Machina,,,,,,,7/19/2002,Not Available,,,,,,,,,"Cybon, Inc.","Z-Kat, Inc.",185,1,0,,,,,,,
1000000881,http://law.lexmachina.com/cases/1000000881,"Townshend Intellectual Property, L.L.C. v. Analog Devices, Inc.",5:02-cv-04835,N.D.Cal.,2002, 10/7/2002,0,5,No Patents Available from Lex Machina,,,,,,,10/7/2002,Not Available,,,,,,,,,"Townshend Intellectual Property, L.L.C.","Analog Devices, Inc.",1422,1,0,,,,,,,
1000000901,http://law.lexmachina.com/cases/1000000901,"Pulse Engineering, Inc. v. Regal Electronics, Inc.",5:03-cv-01837,N.D.Cal.,2003, 4/23/2003,0,8,No Patents Available from Lex Machina,,,,,,,4/23/2003,Not Available,,,,,,,,,"Pulse Engineering, Inc.","Regal Electronics, Inc.",4681,1,0,,,,,,,
1000000917,http://law.lexmachina.com/cases/1000000917,Akers v. Trimble Navigation Limited,5:03-cv-04257,N.D.Cal.,2003, 9/18/2003,0,9,No Patents Available from Lex Machina,,,,,,,9/18/2003,Not Available,,,,,,,,,Akers,Trimble Navigation Limited,6033,0,1,,,,,,,
1000000938,http://law.lexmachina.com/cases/1000000938,Renesas Technology Corp. v. Sandisk Corporation,5:04-cv-01165,N.D.Cal.,2004, 3/24/2004,0,8,No Patents Available from Lex Machina,,,,,,,3/24/2004,Not Available,,,,,,,,,Renesas Technology Corp.,Sandisk Corporation,4792,1,0,,,,,,,
1000000941,http://law.lexmachina.com/cases/1000000941,"Romala Stone, Inc. v. The Home Depot U.S.A., Inc.",5:04-cv-01315,N.D.Cal.,2004,  4/5/2004,0,8,No Patents Available from Lex Machina,,,,,,,4/5/2004,Not Available,,,,,,,,,"Romala Stone, Inc.","The Home Depot U.S.A., Inc.",4854,1,0,,,,,,,
