LMIcaseid,URL,Casetitle,Civilaction,Venue,YearFiled,Filingdate,Declaratoryjudgment,NPECode,Patents,# Of Patents,PrimaryPatent,IPC Url ,IPC,PrimaryClass,First4level,Filingdate1,B4,B3,B2,B1,Q0,A1,A2,A3,A4,Casetitle1,Casetitle2,y,tag,dup,,,,,,,
2000040881,http://law.lexmachina.com/cases/2000053300,Martha Stewart Living Omnimedia Inc v. Lodsys Group LLC,2:13-cv-01074,E.D.Wis.,2013, 9/25/2013,1,1,No Patents Available from Lex Machina,,,,,,,9/25/2013,Not Available,,,,,,,,,Martha Stewart Living Omnimedia Inc,Lodsys Group LLC,467,1,0,,,,,,,
2000040887,http://law.lexmachina.com/cases/2000054185,Fulgham v. Wofford et al,4:13-cv-00182,N.D.Miss.,2013,10/17/2013,0,9,No Patents Available from Lex Machina,,,,,,,10/17/2013,Not Available,,,,,,,,,Fulgham,Wofford et al,6164,1,0,,,,,,,
2000040902,http://law.lexmachina.com/cases/2000054208,"PTS DATA CENTER SOLUTIONS, INC. et al v. ARCHTECH ELECTRONICS CORP.",3:13-cv-06172,D.N.J.,2013,10/16/2013,1,8,No Patents Available from Lex Machina,,,,,,,10/16/2013,Not Available,,,,,,,,,"PTS DATA CENTER SOLUTIONS, INC. et al",ARCHTECH ELECTRONICS CORP.,4678,1,0,,,,,,,
2000040904,http://law.lexmachina.com/cases/2000055046,"COMCAST CABLE COMMUNICATIONS, LLC v. ORLOWSKI et al",2:13-cv-06477,E.D.Pa.,2013, 11/6/2013,0,8,No Patents Available from Lex Machina,,,,,,,11/6/2013,Not Available,,,,,,,,,"COMCAST CABLE COMMUNICATIONS, LLC",ORLOWSKI et al,2435,1,0,,,,,,,
2000040905,http://law.lexmachina.com/cases/2000055098,"Into-Tech Automotive, Inc. v. Need for Seat.com LLC et al",5:13-cv-02022,C.D.Cal.,2013, 11/5/2013,0,8,No Patents Available from Lex Machina,,,,,,,11/5/2013,Not Available,,,,,,,,,"Into-Tech Automotive, Inc.",Need for Seat.com LLC et al,3516,1,0,,,,,,,
2000040907,http://law.lexmachina.com/cases/2000055454,Eclipse IP LLC v. Obey Giant LLC,8:13-cv-01634,C.D.Cal.,2013,10/18/2013,0,1,No Patents Available from Lex Machina,,,,,,,10/18/2013,Not Available,,,,,,,,,Eclipse IP LLC,Obey Giant LLC,255,0,23,,,,,,,
23493,http://law.lexmachina.com/cases/2000056845,"Freight Tracking Technologies, LLC v. APM Terminals Virginis, Inc. et al",1:13-cv-01567,E.D.Va.,2013,12/20/2013,0,1,No Patents Available from Lex Machina,,,,,,,12/20/2013,Not Available,,,,,,,,,"Freight Tracking Technologies, LLC","APM Terminals Virginis, Inc. et al",307,1,0,,,,,,,
2000066614,http://law.lexmachina.com/cases/2000058954,Benedetti v. University of Connecticut et al,3:14-cv-00237,D.Conn.,2014, 2/25/2014,0,9,No Patents Available from Lex Machina,,,,,,,2/25/2014,Not Available,,,,,,,,,Benedetti,University of Connecticut et al,6060,1,1,,,,,,,
23553,http://law.lexmachina.com/cases/2000059163,Enzo Biochem Inc et al v. PerkinElmer Inc et al,1:14-cv-01409,S.D.N.Y.,2014,  3/3/2014,0,8,No Patents Available from Lex Machina,,,,,,,3/3/2014,Not Available,,,,,,,,,Enzo Biochem Inc et al,PerkinElmer Inc et al,2857,1,0,,,,,,,
2000064967,http://law.lexmachina.com/cases/2000059682,Kinekt Design v. One Moment In Time et al,1:14-cv-00028,D.Utah,2014, 3/13/2014,0,8,No Patents Available from Lex Machina,,,,,,,3/13/2014,Not Available,,,,,,,,,Kinekt Design,One Moment In Time et al,3650,1,0,,,,,,,
2000044535,http://law.lexmachina.com/cases/2000060069,Kamdem-Ouaffo v. Pepsico Inc. et al,7:14-cv-00227,S.D.N.Y.,2014, 1/31/2014,0,9,No Patents Available from Lex Machina,,,,,,,1/31/2014,Not Available,,,,,,,,,Kamdem-Ouaffo,Pepsico Inc. et al,6250,1,0,,,,,,,
2000069111,http://law.lexmachina.com/cases/2000060969,GLENMARK GENERICS LTD. et al v. SANOFI-AVENTIS U.S. LLC et al,2:14-cv-02374,D.N.J.,2014, 4/11/2014,1,8,No Patents Available from Lex Machina,,,,,,,4/11/2014,Not Available,,,,,,,,,GLENMARK GENERICS LTD. et al,SANOFI-AVENTIS U.S. LLC et al,3147,1,0,,,,,,,
24380,http://law.lexmachina.com/cases/2000061953,"Cordelia Lighting, Inc. v. Zhejiang Yankon Group Co., Ltd et al",2:14-cv-03388,C.D.Cal.,2014,  5/1/2014,0,8,No Patents Available from Lex Machina,,,,,,,5/1/2014,Not Available,,,,,,,,,"Cordelia Lighting, Inc.","Zhejiang Yankon Group Co., Ltd et al",2484,1,0,,,,,,,
25445,http://law.lexmachina.com/cases/2000062500,"MiMedx Group, Inc. v. Tissue Transplant Technology, Ltd., et al",1:14-cv-00464,W.D.Tex.,2014, 5/16/2014,0,8,No Patents Available from Lex Machina,,,,,,,5/16/2014,Not Available,,,,,,,,,"MiMedx Group, Inc.","Tissue Transplant Technology, Ltd., et al",4070,1,0,,,,,,,
6876,http://law.lexmachina.com/cases/2000063226,"CardiAQ Valve Technologies, Inc. v. Neovasc Inc. et al",1:14-cv-12405,D.Mass.,2014,  6/6/2014,0,8,No Patents Available from Lex Machina,,,,,,,6/6/2014,Not Available,,,,,,,,,"CardiAQ Valve Technologies, Inc.",Neovasc Inc. et al,2283,1,0,,,,,,,
16543,http://law.lexmachina.com/cases/2000064545,JAT Wheels Inc v. DB Motoring Group Inc et al,2:14-cv-05097,C.D.Cal.,2014,  7/1/2014,0,8,No Patents Available from Lex Machina,,,,,,,7/1/2014,Not Available,,,,,,,,,JAT Wheels Inc,DB Motoring Group Inc et al,3576,1,0,,,,,,,
2000051967,http://law.lexmachina.com/cases/2000064896,Pixion Inc. v. Saba Software Inc.,1:14-cv-00953,D.Del.,2014, 7/17/2014,0,8,No Patents Available from Lex Machina,,,,,,,7/17/2014,Not Available,,,,,,,,,Pixion Inc.,Saba Software Inc.,4581,1,0,,,,,,,
79948,http://law.lexmachina.com/cases/2000066826,"State of Vermont v. MPHJ Technology Investments, LLC",2:14-cv-00192,D.Vt.,2014,  9/9/2014,0,6,No Patents Available from Lex Machina,,,,,,,9/9/2014,Not Available,,,,,,,,,State of Vermont,"MPHJ Technology Investments, LLC",1517,1,0,,,,,,,
2000080852,http://law.lexmachina.com/cases/2000067996,Hyatt v. United States Patent and Trademark Office et al,1:14-cv-01300,E.D.Va.,2014, 10/1/2014,0,9,No Patents Available from Lex Machina,,,,,,,10/1/2014,Not Available,,,,,,,,,Hyatt,United States Patent and Trademark Office et al,6224,1,0,,,,,,,
2000050335,http://law.lexmachina.com/cases/2000069256,"Quanex IG Systems, Inc. v. ATN Holding Inc. et al",5:14-cv-02290,C.D.Cal.,2014, 11/6/2014,0,8,No Patents Available from Lex Machina,,,,,,,11/6/2014,Not Available,,,,,,,,,"Quanex IG Systems, Inc.",ATN Holding Inc. et al,4709,1,0,,,,,,,
2000050343,http://law.lexmachina.com/cases/2000069763,"Zetec, Inc. v. Westinghouse Electric Co LLC",2:14-cv-01757,W.D.Wash.,2014,11/17/2014,0,8,No Patents Available from Lex Machina,,,,,,,11/17/2014,Not Available,,,,,,,,,"Zetec, Inc.",Westinghouse Electric Co LLC,5995,1,0,,,,,,,
2000002547,http://law.lexmachina.com/cases/2000070135,"ECCO Sko A/S et al v. Jazame, Inc.",1:14-cv-00533,D.N.H.,2014,11/26/2014,0,8,No Patents Available from Lex Machina,,,,,,,11/26/2014,Not Available,,,,,,,,,ECCO Sko A/S et al,"Jazame, Inc.",2771,1,0,,,,,,,
2000081533,http://law.lexmachina.com/cases/2000071251,"Oxford Biomedical Research, Incorporated v. Zivo Bioscience, Inc.",2:14-cv-14887,E.D.Mich.,2014,12/24/2014,0,8,No Patents Available from Lex Machina,,,,,,,12/24/2014,Not Available,,,,,,,,,"Oxford Biomedical Research, Incorporated","Zivo Bioscience, Inc.",4438,1,0,,,,,,,
2000030141,http://law.lexmachina.com/cases/2000072468,Intense Printing Inc et al v. Performance Printing Corp,3:15-cv-00299,N.D.Tex.,2015, 1/29/2015,0,8,No Patents Available from Lex Machina,,,,,,,1/29/2015,Not Available,,,,,,,,,Intense Printing Inc et al,Performance Printing Corp,3489,1,0,,,,,,,
2000068315,http://law.lexmachina.com/cases/2000073107,"Oakley, Inc. v. Fanatics, Inc.",3:15-cv-00298,S.D.Cal.,2015, 2/12/2015,0,8,No Patents Available from Lex Machina,,,,,,,2/12/2015,Not Available,,,,,,,,,"Oakley, Inc.","Fanatics, Inc.",4328,0,4,,,,,,,
4051,http://law.lexmachina.com/cases/2000073245,"Incipio Technologies, Inc. v. Aplars, LLC",8:15-cv-00277,C.D.Cal.,2015, 2/17/2015,0,8,No Patents Available from Lex Machina,,,,,,,2/17/2015,Not Available,,,,,,,,,"Incipio Technologies, Inc.","Aplars, LLC",3435,1,0,,,,,,,
4814,http://law.lexmachina.com/cases/2000073357,"Magna Mirrors of America, Inc. v. Ficosa International S.A. et al",1:15-cv-00182,W.D.Mich.,2015, 2/19/2015,0,8,No Patents Available from Lex Machina,,,,,,,2/19/2015,Not Available,,,,,,,,,"Magna Mirrors of America, Inc.",Ficosa International S.A. et al,3869,1,0,,,,,,,
8802,http://law.lexmachina.com/cases/2000074100,"Crye Precision, LLC et al v. Duro Textiles, LLC",1:15-cv-01681,S.D.N.Y.,2015,  3/6/2015,0,"8, 12",No Patents Available from Lex Machina,,,,,,,3/6/2015,Not Available,,,,,,,,,"Crye Precision, LLC et al","Duro Textiles, LLC",6842,1,0,,,,,,,
9121,http://law.lexmachina.com/cases/2000074254,Straumann Holding AG et al v. Sirona Dental Systems Inc.,1:15-cv-00222,D.Del.,2015, 3/10/2015,0,8,No Patents Available from Lex Machina,,,,,,,3/10/2015,Not Available,,,,,,,,,Straumann Holding AG et al,Sirona Dental Systems Inc.,5252,1,0,,,,,,,
9301,http://law.lexmachina.com/cases/2000074313,"CandyRific, LLC v. Catanzaro",3:15-cv-00209,W.D.Ky.,2015, 3/12/2015,1,9,No Patents Available from Lex Machina,,,,,,,3/12/2015,Not Available,,,,,,,,,"CandyRific, LLC",Catanzaro,6087,1,0,,,,,,,
9303,http://law.lexmachina.com/cases/2000075132,"Oakley, Inc. v. Lipopsun International Corporation",3:15-cv-00682,S.D.Cal.,2015, 3/26/2015,0,8,No Patents Available from Lex Machina,,,,,,,3/26/2015,Not Available,,,,,,,,,"Oakley, Inc.",Lipopsun International Corporation,4328,0,11,,,,,,,
14542,http://law.lexmachina.com/cases/2000075819,"Leitner-Wise v. Beam Distributing, Inc.,",2:14-cv-00619,E.D.Va.,2014,12/12/2014,0,9,No Patents Available from Lex Machina,,,,,,,12/12/2014,Not Available,,,,,,,,,Leitner-Wise,"Beam Distributing, Inc.,",6278,1,0,,,,,,,
8479,http://law.lexmachina.com/cases/2000077383,"Yoox Corp. v. Landmark Technology, LLC",1:15-cv-03893,S.D.N.Y.,2015, 5/20/2015,0,8,No Patents Available from Lex Machina,,,,,,,5/20/2015,Not Available,,,,,,,,,Yoox Corp.,"Landmark Technology, LLC",5983,1,0,,,,,,,
2000002237,http://law.lexmachina.com/cases/2000078411,"QURIO HOLDINGS, INC. v. COMCAST CABLE COMMUNICATIONS LLC",2:15-cv-03334,E.D.Pa.,2015, 6/12/2015,0,1,No Patents Available from Lex Machina,,,,,,,6/12/2015,Not Available,,,,,,,,,"QURIO HOLDINGS, INC.",COMCAST CABLE COMMUNICATIONS LLC,624,1,0,,,,,,,
12765,http://law.lexmachina.com/cases/2000079729,Brookins v. Parker-Hannifin Corporation,3:15-cv-00065,D.N.D.,2015,  7/9/2015,0,9,No Patents Available from Lex Machina,,,,,,,7/9/2015,Not Available,,,,,,,,,Brookins,Parker-Hannifin Corporation,6079,1,0,,,,,,,
13538,http://law.lexmachina.com/cases/2000080140,"Parthenon Unified Memory Architecture, LLC v. Qualcomm Incorporated et al",3:15-cv-01608,S.D.Cal.,2015, 7/20/2015,0,1,No Patents Available from Lex Machina,,,,,,,7/20/2015,Not Available,,,,,,,,,"Parthenon Unified Memory Architecture, LLC",Qualcomm Incorporated et al,570,1,0,,,,,,,
2000005482,http://law.lexmachina.com/cases/2000080415,DataQuill Limited v. ZTE (USA) Inc.,2:15-cv-01362,E.D.Tex.,2015, 7/28/2015,0,5,No Patents Available from Lex Machina,,,,,,,7/28/2015,Not Available,,,,,,,,,DataQuill Limited,ZTE (USA) Inc.,1036,1,1,,,,,,,
21969,http://law.lexmachina.com/cases/2000081076,CeraMedic LLC v. DePuy Orthopaedics Inc. et al,1:15-cv-00703,D.Del.,2015, 8/13/2015,0,1,No Patents Available from Lex Machina,,,,,,,8/13/2015,Not Available,,,,,,,,,CeraMedic LLC,DePuy Orthopaedics Inc. et al,135,1,0,,,,,,,
8363,http://law.lexmachina.com/cases/2000083157,"Marine Travelift, Inc. v. Ascom SpA et al",1:15-mc-23746,S.D.Fla.,2015, 10/7/2015,0,8,No Patents Available from Lex Machina,,,,,,,10/7/2015,Not Available,,,,,,,,,"Marine Travelift, Inc.",Ascom SpA et al,3897,1,0,,,,,,,
8510,http://law.lexmachina.com/cases/2000083403,Yates v. Adams et al,3:15-cv-04750,N.D.Cal.,2015,10/14/2015,0,9,No Patents Available from Lex Machina,,,,,,,10/14/2015,Not Available,,,,,,,,,Yates,Adams et al,6501,1,0,,,,,,,
97108,http://law.lexmachina.com/cases/2000083695,"Never Lost Golf, LLC et al v. Steinert et al",3:15-cv-00489,N.D.Ind.,2015,10/22/2015,0,"8, 9",No Patents Available from Lex Machina,,,,,,,10/22/2015,Not Available,,,,,,,,,"Never Lost Golf, LLC et al",Steinert et al,7078,1,0,,,,,,,
2000003215,http://law.lexmachina.com/cases/2000084167,KAMDEM-OUAFFO v. COLGATE PALMOLIVE COMPANY et al,2:15-cv-07902,D.N.J.,2015, 11/4/2015,0,9,No Patents Available from Lex Machina,,,,,,,11/4/2015,Not Available,,,,,,,,,KAMDEM-OUAFFO,COLGATE PALMOLIVE COMPANY et al,6249,1,0,,,,,,,
10565,http://law.lexmachina.com/cases/2000084482,"Zodiac Pool Systems, Inc. v. Regal Beloit America, Inc. et al",3:15-cv-02544,S.D.Cal.,2015,11/10/2015,0,8,No Patents Available from Lex Machina,,,,,,,11/10/2015,Not Available,,,,,,,,,"Zodiac Pool Systems, Inc.","Regal Beloit America, Inc. et al",6012,0,1,,,,,,,
2000036911,http://law.lexmachina.com/cases/21740,CELGENE CORPORATION et al v. KV PHARMACEUTICAL COMPANY,3:07-cv-04819,D.N.J.,2007, 10/4/2007,0,8,No Patents Available from Lex Machina,,,,,,,10/4/2007,Not Available,,,,,,,,,CELGENE CORPORATION et al,KV PHARMACEUTICAL COMPANY,2327,0,2,,,,,,,
2000036932,http://law.lexmachina.com/cases/21906,Frayne Consultants v. Transgenomic,1:07-cv-05120,N.D.Ill.,2007, 9/11/2007,0,8,No Patents Available from Lex Machina,,,,,,,9/11/2007,Not Available,,,,,,,,,Frayne Consultants,Transgenomic,3029,1,0,,,,,,,
2000036965,http://law.lexmachina.com/cases/21986,R & M Supply Inc v. IP Holdings LLC et al,5:07-cv-01372,C.D.Cal.,2007,10/18/2007,1,"1, 8",No Patents Available from Lex Machina,,,,,,,10/18/2007,Not Available,,,,,,,,,R & M Supply Inc,IP Holdings LLC et al,6629,1,0,,,,,,,
23842,http://law.lexmachina.com/cases/22013,"Martin Collins Surfaces & Footings, LLC v. Michael W. Dickinson, Inc. et al",2:07-cv-06363,C.D.Cal.,2007, 9/28/2007,0,8,No Patents Available from Lex Machina,,,,,,,9/28/2007,Not Available,,,,,,,,,"Martin Collins Surfaces & Footings, LLC","Michael W. Dickinson, Inc. et al",3903,1,0,,,,,,,
24159,http://law.lexmachina.com/cases/22015,"RED.COM,INC. dba RED DIGITALCAMERA v. 24P, LLC",8:07-cv-01013,C.D.Cal.,2007,  9/4/2007,0,8,No Patents Available from Lex Machina,,,,,,,9/4/2007,Not Available,,,,,,,,,"RED.COM,INC. dba RED DIGITALCAMERA","24P, LLC",4778,1,0,,,,,,,
12896,http://law.lexmachina.com/cases/22041,"Phoenix IP, LLC v. Schneider Electric Enginneering Services, LLC et al",2:07-cv-00464,E.D.Tex.,2007,10/22/2007,0,1,No Patents Available from Lex Machina,,,,,,,10/22/2007,Not Available,,,,,,,,,"Phoenix IP, LLC","Schneider Electric Enginneering Services, LLC et al",583,0,2,,,,,,,
24305,http://law.lexmachina.com/cases/22069,Peter Fish & Co. Pty. Ltd. et al v. Walterscheid et al,1:07-cv-10719,S.D.N.Y.,2007,11/30/2007,1,"8, 9",No Patents Available from Lex Machina,,,,,,,11/30/2007,Not Available,,,,,,,,,Peter Fish & Co. Pty. Ltd. et al,Walterscheid et al,7091,1,0,,,,,,,
79849,http://law.lexmachina.com/cases/22072,Colida v. Sony Ericsson Mobile Communication USA Inc.,1:07-cv-09260,S.D.N.Y.,2007,10/25/2007,0,9,No Patents Available from Lex Machina,,,,,,,10/25/2007,Not Available,,,,,,,,,Colida,Sony Ericsson Mobile Communication USA Inc.,6109,0,3,,,,,,,
2000053803,http://law.lexmachina.com/cases/22122,Papst Licensing GmbH & Co. KG v. OLYMPUS CORP.,1:07-cv-02086,D.D.C.,2007,11/16/2007,0,1,No Patents Available from Lex Machina,,,,,,,11/16/2007,Not Available,,,,,,,,,Papst Licensing GmbH & Co. KG,OLYMPUS CORP.,566,0,1,,,,,,,
4940,http://law.lexmachina.com/cases/22134,Harthcock v. MIPS Technologies Inc et al,2:07-cv-00515,E.D.Tex.,2007,11/27/2007,0,9,No Patents Available from Lex Machina,,,,,,,11/27/2007,Not Available,,,,,,,,,Harthcock,MIPS Technologies Inc et al,6199,1,0,,,,,,,
6728,http://law.lexmachina.com/cases/22136,"z4 Technologies, Inc v. Microsoft Corporation",6:07-cv-00540,E.D.Tex.,2007,11/29/2007,0,5,No Patents Available from Lex Machina,,,,,,,11/29/2007,Not Available,,,,,,,,,"z4 Technologies, Inc",Microsoft Corporation,1479,1,1,,,,,,,
15247,http://law.lexmachina.com/cases/22516,Edge Seal Tech v. Jeld-Wen Inc,2:01-cv-02256,C.D.Ill.,2001,10/16/2001,0,8,No Patents Available from Lex Machina,,,,,,,10/16/2001,Not Available,,,,,,,,,Edge Seal Tech,Jeld-Wen Inc,2783,1,0,,,,,,,
3258,http://law.lexmachina.com/cases/22519,Libman Company v. Wilen Products Inc,2:01-cv-02134,C.D.Ill.,2001,  6/5/2001,0,8,No Patents Available from Lex Machina,,,,,,,6/5/2001,Not Available,,,,,,,,,Libman Company,Wilen Products Inc,3772,1,0,,,,,,,
4436,http://law.lexmachina.com/cases/22523,Midwest Industries v. Leland Engineering,4:00-cv-04099,C.D.Ill.,2000, 12/5/2000,0,8,No Patents Available from Lex Machina,,,,,,,12/5/2000,Not Available,,,,,,,,,Midwest Industries,Leland Engineering,4051,1,1,,,,,,,
90163,http://law.lexmachina.com/cases/22552,"Maui Jim, Inc. v. Seregenti Eyewear, et al",1:04-cv-01149,C.D.Ill.,2004, 5/12/2004,0,8,No Patents Available from Lex Machina,,,,,,,5/12/2004,Not Available,,,,,,,,,"Maui Jim, Inc.","Seregenti Eyewear, et al",3921,0,1,,,,,,,
3076,http://law.lexmachina.com/cases/22557,Gaither Tool Company v. Summit Tool Company,3:03-cv-03198,C.D.Ill.,2003,  9/2/2003,0,8,No Patents Available from Lex Machina,,,,,,,9/2/2003,Not Available,,,,,,,,,Gaither Tool Company,Summit Tool Company,3070,1,0,,,,,,,
2000033083,http://law.lexmachina.com/cases/22562,TAS Distributing Co v. Mack Trucks Inc,1:03-cv-01301,C.D.Ill.,2003, 9/12/2003,0,5,No Patents Available from Lex Machina,,,,,,,9/12/2003,Not Available,,,,,,,,,TAS Distributing Co,Mack Trucks Inc,1403,1,0,,,,,,,
14813,http://law.lexmachina.com/cases/22578,"Kwitek et al v. Zebra Company, LTD et al",2:07-cv-00526,E.D.Tex.,2007, 12/4/2007,0,"5, 9",No Patents Available from Lex Machina,,,,,,,12/4/2007,Not Available,,,,,,,,,Kwitek et al,"Zebra Company, LTD et al",6737,1,0,,,,,,,
17461,http://law.lexmachina.com/cases/22605,Kimberly-Clark Worldwide Inc et al v. Arquest Inc,3:07-cv-02078,N.D.Tex.,2007,12/13/2007,0,8,No Patents Available from Lex Machina,,,,,,,12/13/2007,Not Available,,,,,,,,,Kimberly-Clark Worldwide Inc et al,Arquest Inc,3649,1,0,,,,,,,
17518,http://law.lexmachina.com/cases/23244,Skaggs v. Mocap Incorporated,4:00-cv-00132,E.D.Mo.,2000, 1/27/2000,0,9,No Patents Available from Lex Machina,,,,,,,1/27/2000,Not Available,,,,,,,,,Skaggs,Mocap Incorporated,6416,1,0,,,,,,,
17544,http://law.lexmachina.com/cases/23257,"Hartford Life Ins., et al v. Bancorp Services LLC, et al",4:00-cv-01266,E.D.Mo.,2000,  8/8/2000,1,"8, 9",No Patents Available from Lex Machina,,,,,,,8/8/2000,Not Available,,,,,,,,,"Hartford Life Ins., et al","Bancorp Services LLC, et al",7006,1,0,,,,,,,
17948,http://law.lexmachina.com/cases/23261,"Clipps, Inc. v. Cleaners Supply Co",4:00-cv-01473,E.D.Mo.,2000, 9/13/2000,0,5,No Patents Available from Lex Machina,,,,,,,9/13/2000,Not Available,,,,,,,,,"Clipps, Inc.",Cleaners Supply Co,1010,1,0,,,,,,,
18084,http://law.lexmachina.com/cases/23264,"Monsanto Company v. Nelson, et al",4:00-cv-01636,E.D.Mo.,2000,10/11/2000,0,8,No Patents Available from Lex Machina,,,,,,,10/11/2000,Not Available,,,,,,,,,Monsanto Company,"Nelson, et al",4111,0,15,,,,,,,
18394,http://law.lexmachina.com/cases/23273,"Synergetics, Inc. v. Bausch & Lomb, Inc., et al",4:00-cv-01963,E.D.Mo.,2000,12/12/2000,0,8,No Patents Available from Lex Machina,,,,,,,12/12/2000,Not Available,,,,,,,,,"Synergetics, Inc.","Bausch & Lomb, Inc., et al",5330,1,0,,,,,,,
18652,http://law.lexmachina.com/cases/23279,Jubilee Promotional v. Financial Stationers,4:01-cv-00170,E.D.Mo.,2001,  2/2/2001,0,8,No Patents Available from Lex Machina,,,,,,,2/2/2001,Not Available,,,,,,,,,Jubilee Promotional,Financial Stationers,3609,1,0,,,,,,,
237,http://law.lexmachina.com/cases/23311,"True Fitness Tech v. Procycle Group, Inc.",4:02-cv-00320,E.D.Mo.,2002,  3/4/2002,0,8,No Patents Available from Lex Machina,,,,,,,3/4/2002,Not Available,,,,,,,,,True Fitness Tech,"Procycle Group, Inc.",5612,1,0,,,,,,,
6789,http://law.lexmachina.com/cases/23312,Star Manufacturing v. Pinnacle Equipment,4:02-cv-00321,E.D.Mo.,2002,  3/4/2002,0,8,No Patents Available from Lex Machina,,,,,,,3/4/2002,Not Available,,,,,,,,,Star Manufacturing,Pinnacle Equipment,5220,1,0,,,,,,,
7074,http://law.lexmachina.com/cases/23320,"Drugtech Corporation, et al v. Integrity Pharmaceut",4:02-cv-00927,E.D.Mo.,2002, 6/20/2002,0,8,No Patents Available from Lex Machina,,,,,,,6/20/2002,Not Available,,,,,,,,,"Drugtech Corporation, et al",Integrity Pharmaceut,2710,1,0,,,,,,,
5784,http://law.lexmachina.com/cases/23330,Emerson Electric Co. v. Fanimation Design,4:02-cv-01877,E.D.Mo.,2002,12/11/2002,0,8,No Patents Available from Lex Machina,,,,,,,12/11/2002,Not Available,,,,,,,,,Emerson Electric Co.,Fanimation Design,2835,0,2,,,,,,,
12960,http://law.lexmachina.com/cases/23334,"Cardinal Brands, Inc v. Carens Crafts",4:03-cv-00112,E.D.Mo.,2003, 1/31/2003,0,8,No Patents Available from Lex Machina,,,,,,,1/31/2003,Not Available,,,,,,,,,"Cardinal Brands, Inc",Carens Crafts,2284,1,0,,,,,,,
16594,http://law.lexmachina.com/cases/23344,Cigweld Pty. Ltd. v. Sellstrom Mfg Co,4:03-cv-00456,E.D.Mo.,2003, 4/10/2003,0,8,No Patents Available from Lex Machina,,,,,,,4/10/2003,Not Available,,,,,,,,,Cigweld Pty. Ltd.,Sellstrom Mfg Co,2388,1,0,,,,,,,
3440,http://law.lexmachina.com/cases/23356,"Astrazeneca AB, et al v. KV Pharmaceut Co",4:03-cv-01169,E.D.Mo.,2003, 8/22/2003,0,8,No Patents Available from Lex Machina,,,,,,,8/22/2003,Not Available,,,,,,,,,"Astrazeneca AB, et al",KV Pharmaceut Co,1934,0,2,,,,,,,
16126,http://law.lexmachina.com/cases/23358,"Litecubes, L.L.C., et al v. Master Toys & Novel, et al",4:03-cv-01280,E.D.Mo.,2003,  9/8/2003,0,"8, 9",No Patents Available from Lex Machina,,,,,,,9/8/2003,Not Available,,,,,,,,,"Litecubes, L.L.C., et al","Master Toys & Novel, et al",7051,1,0,,,,,,,
18952,http://law.lexmachina.com/cases/23433,Essex P.B. & R. Corp. v. Niemann,4:06-cv-00146,E.D.Mo.,2006, 1/31/2006,0,9,No Patents Available from Lex Machina,,,,,,,1/31/2006,Not Available,,,,,,,,,Essex P.B. & R. Corp.,Niemann,6140,1,0,,,,,,,
11677,http://law.lexmachina.com/cases/23438,"Magnet Works, Ltd. v. Khan",4:06-cv-00507,E.D.Mo.,2006, 3/24/2006,0,8,No Patents Available from Lex Machina,,,,,,,3/24/2006,Not Available,,,,,,,,,"Magnet Works, Ltd.",Khan,3877,1,0,,,,,,,
6287,http://law.lexmachina.com/cases/23529,"Cytologix Corporation v. Ventana Medical Systems, Inc.",1:07-cv-12374,D.Mass.,2007,12/26/2007,0,8,No Patents Available from Lex Machina,,,,,,,12/26/2007,Not Available,,,,,,,,,Cytologix Corporation,"Ventana Medical Systems, Inc.",2555,1,0,,,,,,,
6367,http://law.lexmachina.com/cases/23558,"Alere Medical, Inc. v. Health Hero Network, Inc.",1:07-cv-07145,N.D.Ill.,2007,12/18/2007,1,8,No Patents Available from Lex Machina,,,,,,,12/18/2007,Not Available,,,,,,,,,"Alere Medical, Inc.","Health Hero Network, Inc.",1709,1,0,,,,,,,
7497,http://law.lexmachina.com/cases/24244,"Klausner Technologies, Inc v. Apple Inc et al",2:08-cv-00117,E.D.Tex.,2008, 3/19/2008,0,5,No Patents Available from Lex Machina,,,,,,,3/19/2008,Not Available,,,,,,,,,Klausner Technologies Inc,Apple Inc et al,1183,1,0,,,,,,,
15380,http://law.lexmachina.com/cases/24420,"West Coast Trends, Inc. v. Armor Gear, LLC",2:08-cv-00160,E.D.Tex.,2008, 4/15/2008,0,8,No Patents Available from Lex Machina,,,,,,,4/15/2008,Not Available,,,,,,,,,"West Coast Trends, Inc.","Armor Gear, LLC",5870,1,0,,,,,,,
16085,http://law.lexmachina.com/cases/24676,"Grace Manufacturing, Inc. v. Goodys Family Clothing, Inc. et al",2:08-cv-02044,W.D.Ark.,2008, 5/16/2008,0,8,No Patents Available from Lex Machina,,,,,,,5/16/2008,Not Available,,,,,,,,,"Grace Manufacturing, Inc.","Goodys Family Clothing, Inc. et al",3186,1,0,,,,,,,
16105,http://law.lexmachina.com/cases/252,"Modern Group, Ltd et al v. Wastequip, Inc et al",1:05-cv-00814,E.D.Tex.,2005, 12/5/2005,0,8,No Patents Available from Lex Machina,,,,,,,12/5/2005,Not Available,,,,,,,,,"Modern Group, Ltd et al","Wastequip, Inc et al",4096,1,0,,,,,,,
25819,http://law.lexmachina.com/cases/25819,Fore-Par Group Inc v. Steven J Stimely et al,8:07-cv-00943,C.D.Cal.,2007, 8/13/2007,0,8,No Patents Available from Lex Machina,,,,,,,8/13/2007,Not Available,,,,,,,,,Fore-Par Group Inc,Steven J Stimely et al,3011,1,0,,,,,,,
259,http://law.lexmachina.com/cases/259,Data Treasury Corporation v. NCR Corporation,2:05-cv-00073,E.D.Tex.,2005, 2/17/2005,0,5,No Patents Available from Lex Machina,,,,,,,2/17/2005,Not Available,,,,,,,,,Data Treasury Corporation,NCR Corporation,1033,0,3,,,,,,,
25948,http://law.lexmachina.com/cases/25948,Sorensen v. Global Machinery Company et al,3:08-cv-00233,S.D.Cal.,2008,  2/5/2008,0,9,No Patents Available from Lex Machina,,,,,,,2/5/2008,Not Available,,,,,,,,,Sorensen,Global Machinery Company et al,6424,0,2,,,,,,,
261,http://law.lexmachina.com/cases/261,"Weatherford/Lamb, Inc. v. Halliburton, Company et al",2:05-cv-00078,E.D.Tex.,2005, 2/22/2005,0,8,No Patents Available from Lex Machina,,,,,,,2/22/2005,Not Available,,,,,,,,,"Weatherford/Lamb, Inc.","Halliburton, Company et al",5850,1,0,,,,,,,
274,http://law.lexmachina.com/cases/274,"Compression Labs, Inc. v. Microsoft Corporation",2:05-cv-00156,E.D.Tex.,2005, 4/21/2005,0,12,No Patents Available from Lex Machina,,,,,,,4/21/2005,Not Available,,,,,,,,,"Compression Labs, Inc.",Microsoft Corporation,6530,1,0,,,,,,,
294,http://law.lexmachina.com/cases/294,"Telecheck International, Inc., v. LML Payments Systems, Inc., et al",2:05-cv-00270,E.D.Tex.,2005, 6/22/2005,0,8,No Patents Available from Lex Machina,,,,,,,6/22/2005,Not Available,,,,,,,,,"Telecheck International, Inc.,","LML Payments Systems, Inc., et al",5403,1,0,,,,,,,
2976,http://law.lexmachina.com/cases/2976,Zorrilla v. Ideal Marketing Grou,1:00-cv-11099,D.Mass.,2000,  6/5/2000,0,9,No Patents Available from Lex Machina,,,,,,,6/5/2000,Not Available,,,,,,,,,Zorrilla,Ideal Marketing Grou,6510,1,0,,,,,,,
3,http://law.lexmachina.com/cases/3,"Konrad v. General Motors Corp, et al",2:00-cv-00021,E.D.Tex.,2000,  2/8/2000,0,9,No Patents Available from Lex Machina,,,,,,,2/8/2000,Not Available,,,,,,,,,Konrad,"General Motors Corp, et al",6266,1,0,,,,,,,
3034,http://law.lexmachina.com/cases/3034,"Dixie EMS Supply v. Alimed, Inc.",1:00-cv-11953,D.Mass.,2000, 9/21/2000,0,8,No Patents Available from Lex Machina,,,,,,,9/21/2000,Not Available,,,,,,,,,Dixie EMS Supply,"Alimed, Inc.",2665,1,0,,,,,,,
